EventTemplate,AdldEventId
Interrupting marked delete block scrubber thread.,1537
Joining redundancy thread.,1538
Joining block report thread.,1539
Interrupted while waiting.,1540
Closing datanode manager.,1541
Stopping pending reconstructions.,1542
Closing blocks map.,1543
"Proxy for https:<*><*>:<*> failed. cause: Connection refused, cause",1544
Removing block pool bpid-<*>,1545
"Couldn't report bad block blk_<*> to datanode<*>, java.io.IOException: Connection refused",1546
Completed block movement. <*>,1547
Exception while moving block replica to target storage type,1548
"Stopping NamenodeHeartbeat service for, NS nameservice<*> NN namenode<*>, nameservice<*>, namenode<*>",1549
Failed to get the used capacity,1550
Unable to extract metrics: Input stream closed,1551
BLOCK* removeStoredBlock: blk_<*> from datanode<*>,1552
BLOCK* removeStoredBlock: blk_<*> removed from caching related lists on node datanode<*>,1553
"LazyWriter was interrupted, exiting",1554
Ignoring exception in LazyWriter:,1555
Excluding DataNodes when allocating new block: <*>,1556
Allocating new block group. The previous block group: BlockGroupInfo{blockGroupId=<*>},1557
"Cannot allocate parity block(index=<*>, policy=RS-<*>-<*>). Exclude nodes=<*>. There may not be enough datanodes or racks...",1558
Current active thread number: <*> queue size: <*> scheduled task number: <*>,1559
AsyncDataService is already shutdown,1560
Failed to move some block's after <*> retries.,1561
User hdfs NN namenode<*>:<*> is using connection Connection@<*>,1562
"SafeMode is in inconsistent filesystem state. BlockManagerSafeMode data: blockTotal=<*>, blockSafe=<*>; BlockManager data: activeBlocks=<*>",1563
NFS COMMIT fileHandle: file_handle_<*> offset=<*> count=<*> client: <*>.<*>.<*>.<*>,1564
Invalid COMMIT request,1565
Doing checkpoint. Last applied: <*>,1566
Waiting until the NameNode rolls its edit logs in order to freeze the BackupNode namespace.,1567
BackupNode namespace frozen.,1568
Checkpointer about to load edits from <*> stream(s).,1569
Reading edits expecting start transaction ID #<*> log suppressed,1570
Start loading edits file edits_<*> maxTxnsToRead = <*>,1571
"Loaded <*> edits file(s) (the last named edits_<*>) of total size <*>, total edits <*>, total load time <*> ms",1572
Unable to roll forward using only logs. Downloading image with txid <*>,1573
Checkpoint completed in <*>.<*> seconds. New Image Size: <*>,1574
Refusing to leave safe mode without a force flag. Exiting safe mode will cause a deletion of <*> byte(s). Please use -forceExit flag to exit safe mode forcefully if data loss is acceptable.,1575
Number of storages reported in heartbeat=<*>; Number of storages in storageMap=<*>,1576
Removed storage disk_<*> from DataNode datanode<*>,1577
Deferring removal of stale storage disk_<*> with <*> blocks,1578
handleWrite org.apache.hadoop.nfs.nfs<*>.request.WRITE<*>Request,1579
No opened stream for fileHandle: file_handle_<*>,1580
"Can't append file: <*> Possibly the file is being closed. Drop the request: write_request, wait for the client to retry...",1581
"Can't close stream for fileHandle: file_handle_<*>, java.io.IOException: Stream closed",1582
Write lock <*>,1583
Validity of parameters checked,1584
New generation stamp and access token set,1585
Log synchronized,1586
Located block with new generation stamp and access token,1587
Operation category is WRITE,1588
Checking operation category is WRITE,1589
Checking validity of parameters,1590
Ensuring new generation stamp is recorded,1591
Checking superuser privilege,1592
Operation unchecked,1593
Checking operation unchecked,1594
Getting datanode storage report,1595
Audit log: Operation successful,1596
DatanodeCommand action from standby NN namenode<*>: DNA_ACCESSKEYUPDATE,1597
Got a command from standby NN namenode<*> - ignoring command: DNA_ERASURE_CODING_RECONSTRUCTION,1598
Unknown DatanodeCommand action: UNKNOWN_COMMAND from standby NN namenode<*>,1599
Checkpoint Period : <*> secs (<*> min),1600
"Transactions count is : <*>, to trigger checkpoint",1601
"Audit: operation=reencryptEncryptionZone, src=<*>, dst=null, perm=null, proto=rpc, user=hdfs",1602
"Storage directory <*><*> does not exist, rootPath",1603
"Cached location of block blk_<*> as <*>, Block block_<*>",1604
File <*><*> skipped re-encryption because edek's key version name is not changed.,1605
File <*> skipped re-encryption because it is not encrypted! This is very likely a bug.,1606
Failed to find datanode datanode<*>,1607
freeing empty stale shm_segment,1608
Snapshot diff report generated.,1609
"Audit: operation=getFileInfo, src=<*>, dst=null, perm=READ, proto=rpc, user=test_user",1610
Starting maintenance of datanode-<*> <*><*> with <*> blocks,1611
"startMaintenance: Node datanode-<*> in NORMAL, nothing to do.",1612
NFS NULL,1613
Got access token error in response to OP_BLOCK_CHECKSUM for file <*> for block blk_<*> from datanode datanode<*>. Will retry the block once.,1614
"src=<*>, datanodes<*>=datanode<*>",1615
Skipped checking <*><*>. Time since last check <*>ms is less than the min gap <*>ms.,1616
Scheduling a check for <*><*>,1617
key = value (default=default_value),1618
Cannot fetch mount table entries from State Store,1619
Removed stale mount point <*> from resolver,1620
Invalidating <*> from MountTableResolver,1621
Removing entry,1622
Location cache after invalidation: {},1623
Added new mount point <*> to resolver,1624
Entry has changed from <*> to <*>,1625
Updated mount point <*> in resolver,1626
Stopping BPOfferServices for nameservices: hdfs:<*><*>,1627
Refreshing list of NNs for nameservices: hdfs:<*><*>,1628
"Cannot initialize ZK node for <*>: java.lang.Exception: ZK error, java.lang.Exception, ZK error message",1629
Can't get local NN thread dump due to java.net.SocketTimeoutException: Read timed out,1630
Exception in closing input stream,1631
"-- Local NN thread dump --, Thread dump data",1632
Using default hostname namenode<*>,1633
FSImageFormatPBSnapshot: Missing referred INodeId <*>,1634
"Recovering lease for file <*>, src=hdfs:<*><*>:<*><*>",1635
"BLOCK* internalReleaseLease: Committed blocks are minimally replicated, lease removed, file closed.",1636
Lease recovery failed for file <*>,1637
Configuration value retrieved successfully.,1638
Failed to initialize HostRestrictingAuthorizationFilter.,1639
The reading thread has been interrupted.,1640
"Last block length <*> is less than reportedLastBlockSize <*>, length - sumBlockLengths, reportedLastBlockSize",1641
"Added lastBlockCrc <*>x<*>a<*>b<*>c<*>d for block index <*> of size <*>, Integer.toString(lastBlockCrc, <*>), locatedBlocks.size() - <*>, consumedLastBlockLength",1642
NameNode rolling its own edit log because number of edits in open segment exceeds threshold of <*>,1643
Swallowing exception in NameNodeEditLogRoller: java.io.IOException: Simulated disk error,1644
"NameNodeEditLogRoller was interrupted, exiting",1645
FileSystem is hdfs:<*><*>:<*>,1646
Ignoring cache report from datanode_<*> because dfs.namenode.caching.enabled = false. number of blocks: <*>,1647
processCacheReport from dead or unregistered datanode: datanode_<*>,1648
"Processed cache report from datanode_<*>, blocks: <*>, processing time: <*> msecs",1649
Chosen nodes: <*>,1650
Excluded nodes: <*>,1651
Chosen nodes:,1652
Excluded nodes:,1653
New Excluded nodes:,1654
"Best effort placement failed: expecting {} replicas, only chose {}.",1655
Only able to place <*> of total expected <*>,1656
Caught exception was: Not enough space,1657
Failed to add all inodes: java.io.IOException: Add all operation failed,1658
Took <*> ms to collect <*> open files with leases under <*>,1659
Rolling forward previously half-completed synchronization: <*> -> <*>; journal id: <*>,1660
Error report from datanode<*>: error message,1661
Disk error on datanode<*>: disk is full,1662
Fatal disk error on datanode<*>: disk failure,1663
Read data interrupted.,1664
getECTopologyResultForPolicies called,1665
Generated new storageID ds-<*>-<*>-abcde for directory <*> with storage type DISK,1666
"BlockReader failed to seek to <*>. Instead, it seeked to <*>.",1667
Exception while seek to <*> from <*> of <*> from https:<*>:<*>,1668
Acquiring write lock to replay edit log,1669
op=FSImageFormat,1670
FSImage.formatEditLogReplayError,1671
replaying edit log: <*>/<*> transactions completed. (<*>%),1672
maxTxnsToRead = <*> actual edits read = <*>,1673
NFS SETATTR fileHandle: FileHandle client: <*>.<*>.<*>.<*>,1674
"Setting file size is not supported when setattr, fileId: <*>",1675
Exception,1676
Uploaded image with txid <*> to namenode at http:<*> in <*>.<*> seconds,1677
Namenode is in safemode,1678
Computing block reconstruction work,1679
Updating block state,1680
Computing invalidate work,1681
DIR* completeFile: request from datanode<*> to complete inode <*><*> which is already closed.,1682
Interrupted when sending OOB message.,1683
Got error when sending OOB message.,1684
Failed to delete restart meta file: <*>,1685
Volume removed successfully.,1686
Remove volume method invoked,1687
EC Topology Verifier Result for specified policies,1688
Audit event: getECTopologyResultForPolicies,1689
CacheManagerSection parsed successfully,1690
Loading cache <*> data,1691
Incrementing counter for cache pool,1692
Error updating cache for metadata_cache,1693
Cache update failed for cache metadata_cache,1694
"Skipping State Store cache update, driver is not ready.",1695
Journal at https:<*><*>:<*> has no edit logs,1696
EditLogManifest response does not have fromUrl field set. Aborting current sync attempt,1697
Aborting current sync attempt.,1698
Got batchedListing: BatchedDirectoryListingInfo,1699
No more elements,1700
Allowed operation WRITE for <*>,1701
concat is enabled,1702
Safe mode is off,1703
FSDirConcatOp.concat is successful,1704
Syncing edit log,1705
User hadoop_user performed concat operation on <*><*> to <*><*> with permissions READ|WRITE,1706
logAuditEvent,1707
Number of suppressed write-lock reports: <*> Longest write-lock held at <*>:<*>:<*> for <*>ms via java.lang.Exception Total suppressed write-lock held time: <*>,1708
DFSClient check open,1709
Closer check completed,1710
Packet queued,1711
Last queued seqno retrieved,1712
Can't send invalid block,1713
bp-<*> Starting thread to transfer blk_<*> to <*>,1714
Adding set replication record to edit log,1715
Removing backup journal https:<*>:<*>,1716
"Successfully cached one replica:block_<*> into persistent memory, <*>",1717
Delete <*><*>.pmem due to unsuccessful mapping.,1718
Shutting down connection pool <*> used <*> seconds ago,1719
Save namespace to <*>,1720
Could not create KeyProvider for DFSClient !!,1721
Unable to stop existing writer for block blk_<*>_<*> after <*> milliseconds.,1722
"Retrieval of slow peer report for all nodes is disabled. To enable it, please enable config dfs.datanode.peer.stats.enabled.",1723
<*> <*> are required for the erasure coding policies: policy-<*>. The number of <*> is only <*>.,1724
"Unable to abort file <*><*>.tmp, due to java.io.IOException: Disk quota exceeded",1725
Unable to delete temporary file <*><*>.tmp during abort,1726
Operation: getFileInfo Status: succeeded TokenId: token_<*>,1727
Could not construct Shared Edits Uri,1728
"The conf property not set properly, it has been configured with different journalnode values",1729
NameNode process will exit now... The saved FsImage fsimage_<*> is potentially corrupted.,1730
The dependency call returned null for host namenode<*>,1731
Failed to change storage policy satisfier as dfs.storage.policy.enabled set to false,1732
"Updating SPS service status, current mode:INTERNAL, new mode:EXTERNAL",1733
"Updating SPS service status, current mode:EXTERNAL, new mode:EXTERNAL",1734
"Storage policy satisfier is already in mode:EXTERNAL, so ignoring change mode event.",1735
"Updating SPS service status, current mode:NONE, new mode:NONE",1736
"Storage policy satisfier is already disabled, mode:NONE so ignoring change mode event.",1737
"Updating SPS service status, current mode:INTERNAL, new mode:NONE",1738
"Disabling StoragePolicySatisfier, mode:INTERNAL",1739
"Updating SPS service status, current mode:INTERNAL, new mode:INVALID",1740
Given mode: INVALID is invalid,1741
Checking if security is enabled,1742
this + : + removedFrom + no longer contains + replica + . refCount + (<*> - <*>) + -> + <*> + StringUtils.getStackTrace(Thread.currentThread()),1743
Got IOException at position <*>,1744
Attempt to insert record <*><*> that already exists,1745
Getting the file status for <*>,1746
Path <*> is a folder.,1747
Found the path: <*> as a file.,1748
Cannot write data to <*><*>,1749
Attempt to insert record <*> that already exists,1750
Namenode is not operational: StandbyNamenodeInfo,1751
Received service state: ACTIVE from HA namenode: ActiveNamenodeInfo,1752
Reporting non-HA namenode as operational: StandbyNamenodeInfo,1753
Cannot register namenode NamenodeStatusReport,1754
"Block recovery attempt for block-<*> rejected, as the previous attempt times out in <*> seconds.",1755
BLOCK* NameSystem.LowRedundancyBlock.remove: Removing block blk_<*> from priority queue <*>,1756
"Exception while creating remote block reader, datanode datanode<*>:<*>",1757
Failed to get number of blocks pending replica,1758
"visiting org.apache.hadoop.hdfs.server.datanode.ReplicaInfo with outstandingMmapCount=<*>, replicas=<*>, failedLoads=<*>, evictable=true, evictableMmapped=false",1759
NFS PATHCONF fileHandle: file_handle_<*> client: client_address,1760
Can't get path for fileId: file_id_<*>,1761
error closing TcpPeerServer: java.io.IOException: Connection reset by peer,1762
Formatting storage directory,1763
Compiling report for volume: ProvidedVolumeImpl; bpid: someBpid,1764
Audit event logged,1765
Cannot remove record <*>,1766
"Cannot remove records com.example.MyClass query SELECT * FROM table WHERE id = <*>, java.lang.Exception: Remove operation failed",1767
Cannot remove records RouterNamenode class org.apache.hadoop.hdfs.server.federation.store.records.RouterNamenode query RouterNamenodeQueryFilter,1768
Cannot remove records com.example.AnotherClass query SELECT * FROM another_table WHERE status = <*>,1769
Cannot remove <*><*>,1770
Reconfiguring <*> to <*>,1771
RECONFIGURE* changed datanode to <*>ms,1772
Reconfiguring dfs.datanode.fileio.profiling.sampling.percentage to <*>,1773
DFSConfigKeys.DFS_DATANODE_FILEIO_PROFILING_SAMPLING_PERCENTAGE_KEY set to <*>. Disabling file IO profiling,1774
DFSConfigKeys.DFS_DATANODE_FILEIO_PROFILING_SAMPLING_PERCENTAGE_KEY set to <*>. Enabling file IO profiling,1775
Disk Outlier Detection daemon did not shutdown,1776
Reconfiguring dfs.datanode.min.outlier.detection.disks to <*>,1777
Handling deprecation for property,1778
Reconfiguring dfs.datanode.slowdisk.low.threshold.ms to <*>,1779
message,1780
RECONFIGURE* changed dfs.datanode.outliers.report.interval.ms to <*>,1781
NameSystem.concat to <*>,1782
DIR* NameSystem.appendFile: file <*> for datanode<*> at <*>.<*>.<*>.<*> block blk_<*> block size <*>,1783
Cannot generate JSON of mount table from store: NullPointerException,1784
"Block recovery: Ignored replica with invalid original state: BlockInfo(blockId=<*>, numBytes=<*>, generationStamp=<*>, replicas=<*>]) from DataNode: datanode_<*>",1785
"Failed to recover block (block=BlockInfo(blockId=<*>, numBytes=<*>, generationStamp=<*>, replicas=<*>]), datanode=datanode_<*>)",1786
"Block recovery for block BlockInfo(blockId=<*>, numBytes=<*>, generationStamp=<*>, replicas=<*>]) succeeded",1787
"Block recovery: DataNode: datanode_<*> does not have replica for block: BlockInfo(blockId=<*>, numBytes=<*>, generationStamp=<*>, replicas=<*>])",1788
Finalizing upgrade of storage directory <*>,1789
Finalize upgrade for <*> is complete.,1790
Loading INode directory section.,1791
Finished loading INode directory section in <*>ms,1792
Refresh Responses:,1793
Failed to get response.,1794
Setting up storage: nsid=<*>; bpid=BP-<*>-<*>.<*>.<*>.<*>-<*>; lv=-<*>; nsInfo=<*>; dnuuid=<*>ba<*>-<*>-<*>c<*>-b<*>b-<*>dd<*>a<*>f,1795
"The Short Circuit Local Read latency, <*> ms, is higher then the threshold (<*> ms). Suppressing further warnings for this BlockReaderLocal.",1796
Access denied to user hadoop_user for operation READ on <*>,1797
"Invalid delegation token, attempting to renew",1798
Renewed delegation token successfully,1799
IOException occurred while connecting to datanode: Connection refused,1800
Retrying connection to datanode after <*> seconds,1801
rollEditLog,1802
addDirective of Cache directive for pool data_pool_<*> and path <*> <*> <*> <*> <*> <*> <*>,1803
"Skipping disk from computation. Maximum data size achieved., <*><*>",1804
"Next Step: MOVE, MOVE",1805
"Skipping disk from computation. <*> data size achieved., <*><*>",1806
"Skipping disk from computation. Minimum data size achieved., <*><*>",1807
"Queued <*>, <*>",1808
Exception in doCheckpoint:,1809
Throwable Exception in doCheckpoint:,1810
"dfs.namenode.decommission.max-concurrent-tracked-nodes is set to an invalid value, it must be zero or greater. Defaulting to <*>, dfs.namenode.decommission.max-concurrent-tracked-nodes, <*>",1811
IOUtils.cleanupWithLogger called,1812
getJournalManager().doRollback called,1813
storage.refreshStorage called,1814
ShortCircuitCache: cache cleaner running at <*>,1815
CacheCleaner: purging replica,1816
ShortCircuitCache: finishing cache cleaner run started at <*>. Demoted <*> mmapped replicas; purged <*> replicas.,1817
Removing re-encryption status of zone zone-<*>,1818
Exception while edit logging: Disk is full,1819
Unable to fetch namespace information from any remote NN. Possible NameNodes: <*>,1820
Layout version on remote node <*> does not match this node's layout version <*>,1821
The active NameNode is in Upgrade. Prepare the upgrade for the standby NameNode as well.,1822
*BLOCK* NameNode.blockReceivedAndDeleted: from datanode-<*> <*> blocks.,1823
"do write, fileHandle <*><*> offset: <*> length: <*> stableHow: UNSTABLE, handle.dumpFileHandle(), <*>, <*>, UNSTABLE.name()",1824
"After writing <*> at offset <*>, updated the memory count, new value: <*>, handle.dumpFileHandle(), <*>, nonSequentialWriteInMemory.get()",1825
Update nonSequentialWriteInMemory by -<*> new value: <*>,1826
BLOCK* processReport: logged info for <*> of <*> reported.,1827
BLOCK added as corrupt on datanode by client,1828
BLOCK duplicate requested for block to add as corrupt on datanode by client,1829
BLOCK InvalidateBlocks: add Block to DatanodeInfo,1830
"Replica state finalized, adding stored block",1831
Sum: <*> + sum Bucket: updateTime: <*> timeStr (<*>) isStale false at <*>,1832
Error reported on storage directory <*><*>,1833
current list of storage dirs:<*>,1834
Unable to unlock bad storage directory: <*><*>,1835
About to remove corresponding storage: <*><*>,1836
Resuming re-encrypt handler for testing.,1837
IOException occurred during write operation.,1838
"WriteChunk allocating new packet seqno=<*>, src=datanode<*>, packetSize=<*>, chunksPerPacket=<*>, bytesCurBlock=<*>, output stream=java.io.DataOutputStream@<*>a<*>b<*>c<*>d",1839
Failed to find inode <*> in getNumUnderConstructionBlocks().,1840
The file <*> is not under construction but has lease.,1841
Number of blocks under construction: <*>,1842
Log<*>j is required to enable async auditlog,1843
Deprecated configuration key dfs.deprecated.key will be ignored.,1844
Please update your configuration to use dfs.new.key instead.,1845
"Activating DatanodeAdminManager with interval <*> seconds, <*> max blocks per interval, <*> max concurrently tracked nodes.",1846
Stopping InMemoryLevelDBAliasMapServer,1847
File system corrupted,1848
Checksum calculation succeeded on block file,1849
"initReplicaRecovery: block=<*>:<*>, recoveryId=<*>, replica=Replica<*>",1850
initReplicaRecovery: update recovery id for block=<*>:<*> from <*> to <*>,1851
initReplicaRecovery: changing replica state for block=<*>:<*> from RBW to RUR,1852
"bpid_<*> has some block files, cannot delete unless forced",1853
"storageTypes=<*>, storageTypes=<*>",1854
"Failed to place enough replicas, still in need of <*> to reach <*> (unavailableStorages=<*>, storagePolicy=BlockStoragePolicy<*>, newBlock=true) java.lang.Exception",1855
"Failed to place enough replicas, still in need of <*> to reach <*> (unavailableStorages=<*>, storagePolicy=BlockStoragePolicy<*>, newBlock=true) Not enough replicas are available.",1856
Added export: <*> FileSystem URI: hdfs:<*><*>:<*> with namenodeId: <*>,1857
"FS:hdfs, Namenode ID collision for path:<*> nnid:<*> uri being added:hdfs:<*><*>:<*> existing uri:hdfs:<*><*>:<*>",1858
Calling mkdirs,1859
Token cancel failed: java.io.IOException: Connection reset,1860
RECONFIGURE* changed <*> to <*>,1861
Marking all datanodes as stale,1862
Configuration ignoring reserved path .reserved,1863
Configuration ignoring relative path relative<*>,1864
Configuration ignoring path hdfs:<*>:<*><*> with scheme,1865
"No policy name is specified, set the default policy name instead",1866
Set erasure coding policy RS_<*>_<*> on <*>,1867
"close(filename=<*>, block=<*>)",1868
Creating non-HA Proxy,1869
Processing RPC with index <*> out of total <*> RPCs in processReport <*>x<*>a<*>b<*>c<*>d,1870
"Update nonSequentialWriteInMemory by <*> new value: <*>, count, newValue",1871
Queueing reported block blk_<*> in state QUEUED from datanode datanode<*> for later processing because block is under construction.,1872
Block token with <*> doesn't have the correct token password,1873
"Unable to de-serialize block token identifier for user=hadoop_user, block=data_block, access mode=READ",1874
Cannot get Routers JSON from the State Store,1875
"Reconfiguring dfs.datanode.data.dir to <*><*>,<*><*>",1876
"Exception while sending the block report after refreshing + volumes dfs.datanode.data.dir to <*><*>,<*><*>",1877
Operation check successful for user hadoop_user,1878
"Retrieved namespaces: ns<*>, ns<*>, ns<*>",1879
Merged results from concurrent operations,1880
Cannot get remote user: Authentication required,1881
Cannot get mount point: Mount point <*> not found,1882
Cannot get mount point: Mount point retrieval failed,1883
Roll Edit Log from <*>.<*>.<*>.<*>,1884
"Exception while selecting input streams, java.io.IOException: Gap detected in journal stream",1885
FSDirectory.verifyMaxDirItems: Too many children.,1886
Resuming re-encrypt updater for testing.,1887
Ignoring unknown CryptoProtocolVersion provided by client: UNKNOWN,1888
Starting decommission of datanode-<*> disk-<*> with <*> blocks,1889
"startDecommission: Node datanode-<*> in NORMAL, nothing to do.",1890
Disk Balancer : Scheduler did not terminate.,1891
Refresh user groups mapping in Router.,1892
"computePacketChunkSize: src=<*>, chunkSize=<*>, chunksPerPacket=<*>, packetSize=<*>",1893
Unexpected meta-file version for <*>: version in file is <*> but expected version is <*>,1894
Open AuthenticatedURL connection to https:<*>:<*>,1895
"Setting token value to null, resp=<*>",1896
"Will fetch a new encryption key and retry, encryption key was invalid when connecting to this.src : lastException",1897
BLOCK* fsync: <*> for datanode<*>,1898
Removing SPS hint,1899
RPC operation check executed,1900
Namespaces retrieved,1901
Concurrent invocation executed,1902
Retrieval of results initiated,1903
Proxying operation: readData,1904
Block block-<*> NONEXISTENT_STATUS,1905
Fsck on block-<*>,1906
Error in looking up block,1907
Performing hsync operation on DFSOutputStream,1908
socket_<*>: error shutting down shm: got IOException calling shutdown(SHUT_RDWR),1909
"Failed to choose remote rack (location = <*> + <*>), fallback to local rack",1910
DIR* NameSystem.mkdirs: <*>,1911
DIR* NameSystem.mkdirs,1912
Namenode startup checks passed.,1913
Checking operation permissions.,1914
Waiting for completion in RetryCache.,1915
Modifying cache pool data_pool_<*>.,1916
Setting state in RetryCache.,1917
Cannot schedule check on null volume,1918
"addCachePool of CachePoolInfo(poolName=data_pool_<*>, ownerName=hadoop_user, groupName=hdfs, mode=READ|WRITE, limit=<*>, maxRelativeExpiry=<*>) failed: java.io.IOException: Operation failed",1919
"addCachePool of CachePoolInfo(poolName=data_pool_<*>, ownerName=hadoop_user, groupName=hdfs, mode=READ|WRITE, limit=<*>, maxRelativeExpiry=<*>) successful.",1920
"GOT EXCEPITION, e",1921
Unable to load className,1922
"Unable to de-serialize block token identifier for user=data_user, block=Block_<*>_<*>, access mode=READ",1923
Block token with block_token_<*> doesn't have the correct token password,1924
Check access completed successfully,1925
"storageTypes={}, storageTypes",1926
"Failed to place enough replicas, still in need of...",1927
Failed to place enough replicas...,1928
DIR* NameSystem.renameTo: with options - <*> to <*>,1929
rename destination cannot be the root,1930
Got null reader from BlockAliasMap,1931
A block with id <*> exists locally. Skipping PROVIDED replica,1932
this: the DfsClientShmManager is closed.,1933
"Failed to choose target datanode for the required storage types DISK, block:blk_<*>, existing storage type: SSD",1934
recycle: array.length=<*>,1935
"recycle: array.length=<*>, freeQueueSize=<*>",1936
writeTo <*> is <*> of size <*>,1937
RpcIds logging enabled,1938
Edit logging enabled,1939
gc window of metric: getFileInfo userName: hadoop_user,1940
offer window of metric: getFileInfo userName: hadoop_user sum: <*>,1941
topN users size for command getFileInfo is: <*>,1942
Adding cache directive info,1943
addDirective: you cannot specify an ID for this operation.,1944
demoteOldEvictable: demoting replica: <*><*>: Rationale: Block exceeded lifespan: java.lang.Exception,1945
demoteOldEvictable: demoting replica: eviction due to low memory: stack trace,1946
*DIR* NameNode.rename: <*> to <*>,1947
"Pending edits to IPCLoggerChannel.this is going to exceed limit size: <*>MB, current queued edits size: <*>MB, will silently drop <*> bytes of edits!",1948
"Got user: hdfs, remoteIp: <*>.<*>.<*>.<*>, path: <*>",1949
