EventTemplate,AdldEventId
Building remote locations list,4087
Setting destination locations,4088
Setting owner name and group,4089
Applying default permissions,4090
Setting quota for mount table,4091
Validating mount table record,4092
Begin step for saving cache pools,4093
Set total cache pools,4094
Incrementing counter for each cache pool,4095
End step for saving cache pools,4096
Bad checksum type: CRC<*>C. Using default CRC<*>,4097
Set total to size of <*>,4098
Key written and counter incremented,4099
"The openFileCtx is not active anymore, fileId: <*>",4100
Another async task is already started before this one is finalized. fileId: <*> asyncStatus: true original startOffset: <*> new startOffset: <*>. Won't change asyncStatus here.,4101
Configuration value is invalid. Value must be greater than or equal to <*>.,4102
"Using <*> threads to upgrade data directories (upgrade.threads=<*>, dataDirs=<*>)",4103
"Check node: datanode-<*>:<*>, type: DATA_NODE.",4104
"Probe failed, datanode: datanode-<*>:<*>, type: DATA_NODE, java.net.SocketTimeoutException: <*>ms timeout.",4105
closeFile: <*> with <*> blocks is persisted to the file system,4106
doEditTx() op=OP_CLOSE txid=<*>,4107
Cancelling <*> re-encryption tasks,4108
Could not read or failed to verify checksum for data at offset <*> for block blk_<*>,4109
"Node datanode-<*> is sufficiently replicated and healthy, marked as DECOMMISSIONED.",4110
Node datanode-<*> completed decommission and maintenance but has been moved back to in service,4111
Node datanode-<*> is in an unexpected state IN_SERVICE and has been removed from tracking for decommission or maintenance,4112
Node datanode-<*> isn't healthy. It needs to replicate <*> more blocks. DECOMMISSION_INPROGRESS is still in progress.,4113
DIR* FSDirectory.unprotectedRenameTo: src is renamed to dst,4114
data: <*>A<*>B<*>C<*>D<*>E<*>F,4115
Received non-NN<*> request for edits from datanode<*>,4116
Removing pending reconstruction for block_<*>,4117
Setting up servlets,4118
HTTP server started on address,4119
Found existing servlet at path; will replace mapping with servlet,4120
Node is not chosen due to being too busy (load: <*>.<*> > <*>.<*>),4121
Successfully connected to datanode<*>:<*>,4122
"Will fetch a new encryption key and retry, encryption key was invalid when connecting to ...",4123
"Failed to connect to ... for file ... for block ..., add to deadNodes and continue.",4124
"Add to local dead nodes, previously was .",4125
Failed to getReplicaVisibleLength from datanode for block,4126
"Failed to connect to datanode<*>:<*> for file <*> for block blk_<*>, add to deadNodes and continue.",4127
File <*> already exists.,4128
Received exception while processing <*>: RemoteException,4129
Writing to id file <*> from host namenode<*>,4130
Flushing data to disk for <*>,4131
Successfully deleted <*> on exit.,4132
Creating new file <*>,4133
File system supports hflush capability.,4134
Deleting <*> on exit.,4135
Watcher for tokens is disabled in this secret manager,4136
Start loading token cache,4137
Error rebuilding local cache for zkDelegationTokens,4138
Loaded token cache in <*> milliseconds,4139
NFS READDIRPLUS fileHandle: <*> cookie: <*> dirCount: <*> + maxCount: <*> client: /<*>.<*>.<*>.<*>,4140
Error parsing protocol buffer of EZ XAttr xattr_name dir:<*>,4141
No mover threads available: skip moving pending block,4142
Removed pending block from <*> <*>,4143
Executing move operation,4144
Initialized Dispatcher with pending move,4145
"Mismatched block IDs or generation stamps, attempting to replace block blk_<*>_<*> with blk_<*>_<*> as block # <*>/<*> of <*>",4146
Removing stored block blk_<*> from datanode_<*>,4147
Removing stored block blk_<*> has already been removed from node datanode_<*>,4148
"ExcessRedundancyMap.remove(blk_<*>, datanode_<*>)",4149
Removing stale replica blk_<*> of file <*>,4150
Trying to remove a block from file <*> which is not under construction.,4151
Trying to remove more than one block from file <*>,4152
Processing previously queued message,4153
addStoredBlock: block blk_<*> moved to storageType SSD on node datanode_<*>,4154
Trying to delete non-existant block blk_<*>_<*>,4155
DIR* FSDirectory.removeBlock: with block is removed from the file system,4156
"getNextSubDir(<*>, <*>): no subdirectories found in <*>",4157
"getNextSubDir(<*>, <*>): picking next subdirectory subdir<*> within <*>",4158
Could not obtain block: block_<*>_<*> size <*> from datanode<*>:<*>. Throwing a BlockMissingException,4159
No node available for block_<*>_<*> size <*>,4160
Could not obtain block_<*>_<*> from any node: java.net.ConnectException: Connection refused. Will get new block locations from namenode and retry...,4161
"DFS chooseDataNode: got #<*> IOException, will wait for <*> msec.",4162
"Failed to reconstruct striped block: block_group_<*>, java.io.IOException: Reconstruction failed",4163
Interrupted waiting for peers to close,4164
Printing to screen enabled,4165
"XML input detected, processing with XML processor",4166
"Binary input detected, processing with binary processor",4167
Creating edits visitor,4168
Failed to load edits,4169
java.lang.Exception: Load edits failed,4170
Currently creating proxy using LossyRetryInvocationHandler requires NN HA setup,4171
removeStoredBlock: block_<*> from datanode_<*>,4172
removeStoredBlock: block_<*> has already been removed from node datanode_<*>,4173
removeStoredBlock: block_<*> removed from caching related lists on node datanode_<*>,4174
Completing previous upgrade for storage directory <*>,4175
Periodic Directory Tree Verification scan is disabled because verification is turned off by configuration,4176
Periodic Directory Tree Verification scan is disabled because verification is not supported by SimulatedFSDataset,4177
"Proxy for https:<*>:<*> failed. cause: Connection refused, cause",4178
Initializing cache loader: MemoryMappableBlockLoader.,4179
Connecting to datanode <*>.<*>.<*>.<*>:<*>,4180
Lease for <*><*> has expired hard limit,4181
Cannot release the path <*><*> in the lease Lease<*>. It will be retried.,4182
Lease recovery for inode <*> is complete. File closed,4183
Started block recovery block_<*> lease Lease<*>,4184
BlockPoolService starting to offer service,4185
Initialization failed for BlockPoolService because Connection refused (connection refused),4186
"Exception in BPOfferService for BlockPoolService, java.lang.Exception: Offer service failed",4187
Ending block pool service for: BlockPoolService,4188
"Initialization failed for BlockPoolService. Exiting., java.net.ConnectException: Connection refused",4189
"Unexpected exception in block pool BlockPoolService, java.lang.Throwable: Submission failed",4190
"Resetting bytesOnDisk to match blockDataLength (<*>) for replica <*>, blockDataLength, rbw",4191
Report to <*>,4192
Failed to transfer data: Connection reset,4193
<*> <symlink>,4194
Recovering unfinalized segments in <*>,4195
Deleting zero-length edit log file edit_inprogress_<*>,4196
Moving aside edit log file that seems to have zero transactions edit_<*>-<*>,4197
Deleting zero-length edit log file EditLogFile,4198
Moving aside edit log file that seems to have zero transactions EditLogFile,4199
Last block locations not available. Datanodes might not have reported blocks completely. Will retry for <*> times,4200
Purging remote journals older than transaction ID + <*>,4201
BLOCK markBlockAsCorrupt: block_<*> cannot be marked as corrupt as it does not belong to any file,4202
Metrics logging will not be async since the logger is not log<*>j,4203
Starting up router,4204
"Failed to start router, java.lang.Exception",4205
"Only using the first part of the path: <*> -> <*>, <*>, <*>",4206
Using NN principal: nameNode<*><*>@REALM.COM,4207
Got unexpected attribute: XML_ATTRIBUTE,4208
Got unxpected characters while looking for element: data,4209
Got unexpected end event while looking for element,4210
Failed to find <element_name>; got other_element instead.,4211
Skipping XMLEvent of type OTHER_EVENT(xml event),4212
Saving image file <*> using LZ<*>,4213
Image file <*> of size <*> bytes saved in <*>.<*> seconds,4214
"enqueue full false, src=datanode<*>, bytesCurBlock=<*>, blockSize=<*>, appendChunk=true, currentPacket, datanode<*>, <*>, <*>, true, DataStreamer",4215
Disabling StoragePolicySatisfier service as dfs.storage.policy.enabled set to false.,4216
"Storage policy satisfier is configured as external, please start external sps service explicitly to satisfy policy",4217
Storage policy satisfier is disabled,4218
Given mode: invalid_mode is invalid,4219
"DataNode datanode<*>, datanode<*> are congested. Backing off for <*> ms",4220
Router <*> address: https:<*>:<*>,4221
"Cannot locate RPC service address for NN namenode<*>, using RPC address https:<*>:<*>",4222
Router <*> RPC address: https:<*>:<*>,4223
NamenodeDescriptor <*> address: localhost:<*>,4224
NamenodeDescriptor <*> RPC address: localhost:<*>,4225
Error message from exception,4226
Failed to get provided capacity,4227
Namenode address: https:<*>:<*>,4228
Current state: ACTIVE,4229
Last heartbeat time: <*>,4230
Max block report size: <*>,4231
Block pool ID: pool-<*>,4232
"Available space volume choosing policy initialized: dfs.datanode.available-space-volume-choosing-policy.balanced-space.threshold = <*>.<*>, dfs.datanode.available-space-volume-choosing-policy.balanced-space.preference-fraction = <*>.<*>",4233
The value of dfs.datanode.available-space-volume-choosing-policy.balanced-space.preference-fraction is greater than <*>.<*> but should be in the range <*>.<*> - <*>.<*>,4234
The value of dfs.datanode.available-space-volume-choosing-policy.balanced-space.preference-fraction is less than <*>.<*> so volumes with less available disk space will receive more block allocations,4235
Synchronizing log segment_<*> from https:<*>:<*><*>,4236
Failed to delete temporary file <*>,4237
Caught exception while adding replicas from data_volume in subtask. Will throw later.,4238
"Zone data_zone_<*> starts re-encryption processing, zoneId",4239
there are no corrupt file blocks.,4240
Exact path handle not supported by filesystem,4241
Permission denied while accessing pool hdd_pool_<*>: user flink_cluster does not have RWX permissions.,4242
doEditTx() op=null txid=null,4243
New namespace image has been created,4244
Renewing delegation token for hadoop_user,4245
"Mount table entries cache refresh successCount=<*>,failureCount=<*>",4246
Directory is valid,4247
Unable to delete cancelled checkpoint in <*>,4248
Failed to get key version name for <*><*>,4249
Re-encryption using key version,4250
Zone zone_reencrypt(<*>) is submitted for re-encryption.,4251
Cancelled zone zone_reencrypt(<*>) for re-encryption.,4252
Zone zone_reencrypt completed re-encryption.,4253
NameNode low on available disk space. Entering safe mode.,4254
NameNode low on available disk space. Already in safe mode.,4255
Exception in NameNodeResourceMonitor: Disk full on <*><*>,4256
Problem getting block size,4257
Cannot get mount point,4258
Unexpected exception proxying to,4259
Relaying an out of band ack of type HAS_DOWNSTREAM_IN_PIPELINE,4260
got sequence number <*>,4261
"Audit:hadoop_user,READ,<*>,<*>.<*>.<*>.<*>",4262
Dead node datanode<*> is put in maintenance state immediately.,4263
Decommissioned node datanode<*> is put in maintenance state immediately.,4264
MinReplicationToBeInMaintenance is set to zero. datanode<*> is put in maintenance state immediately.,4265
Unable to extract metrics: null,4266
"Cannot get active NN for nameservice<*>, State Store unavailable",4267
Cannot locate eligible NNs for nameservice<*>,4268
Cannot get disabled name services,4269
Set owner operation created,4270
Syntax error in URI hdfs:<*>:<*><*> Please check hdfs configuration.,4271
Assuming <*> scheme for path hdfs:<*>:<*><*> in configuration.,4272
Stopping services started for active state,4273
"Set quota for path: nsId: <*>, dest: <*>",4274
Received RPC call from client machine,4275
Zone zone-<*> will retry re-encryption,4276
Prepared recovery for segment <*>: state: ACCEPTED epoch: <*> committedTxId: <*>; journal id: journal-<*>,4277
Cannot parse line invalid_data in file <*>,4278
Refreshing SuperUser proxy group mapping list,4279
"Failed to choose from the next rack (location = <*>), retry choosing randomly",4280
Namenode HA-actor trying to claim ACTIVE state with txid=<*>,4281
Acknowledging ACTIVE Namenode HA-actor,4282
Namenode HA-actor taking over ACTIVE state from datanode-<*> at higher txid=<*>,4283
NN HA-actor tried to claim ACTIVE state at txid=<*> but there was already a more recent claim at txid=<*>,4284
Namenode HA-actor relinquishing ACTIVE state with txid=<*>,4285
Safe mode ON.,4286
Reconfiguring dfs.datanode.peer.stats.enabled to true,4287
RECONFIGURE* changed dfs.datanode.peer.stats.enabled to true,4288
Block pool id required to get aliasmap reader,4289
Exception in retrieving block pool id data_pool_<*>,4290
Failed to get number of blocks under replicated,4291
"Re-scanned block blk_<*>, result is PROCESSED",4292
"The current effective storage policy id : <*> is not suitable for striped mode EC file : file_<*>. So, just returning unspecified storage policy id",4293
Getting the block pool id,4294
"Error during write properties to the VERSION file to <*>, <*>, java.io.IOException: Operation failed",4295
Failed to start web server due to java.io.IOException: Address already in use,4296
<NameSection> is missing <namespaceId>,4297
"NS_INFO writing header: {namespaceId: <*>, genstampV<*>: <*>, genstampV<*>: <*>, genstampV<*>Limit: <*>, lastAllocatedBlockId: <*>, transactionId: <*>, rollingUpgradeStartTime: <*>, lastAllocatedStripedBlockId: <*>}",4298
Trash directory for replica <*><*> is null,4299
Moving files <*><*> and <*><*> to trash.,4300
Caught exception after scanning through <*> ops from https:<*>:<*> while determining its valid length. Position was <*>.,4301
"After resync, position is <*>.",4302
"After resync, the position, <*> is not greater than the previous position <*>. Skipping remainder of this log.",4303
Ignoring exception,4304
"Start moving block: block_<*> from src: datanode<*> to destin: datanode<*> to satisfy storageType, sourceStoragetype:DISK and destinStoragetype:SSD",4305
Connecting to datanode <*>,4306
Successfully moved block: block_<*> from src: datanode<*> to destin: datanode<*> for satisfying storageType: SSD <*>,4307
"Pinned block can't be moved, so skipping block: block_<*> <*>",4308
Failed to move block: block_<*> from src: datanode<*> to destin: datanode<*> to satisfy storageType: SSD,4309
"Start moving block: blk_<*> from src: dn_<*> to destin: dn_<*> to satisfy storageType, sourceStoragetype: DISK and destinStoragetype: ARCHIVE",4310
"SASL client doing encrypted handshake for addr = <*>.<*>.<*>.<*>:<*>, datanodeId = dn_<*>",4311
Successfully moved block: blk_<*> from src: dn_<*> to destin: dn_<*> for satisfying storageType: ARCHIVE,4312
"Detected a loopback TCP socket, disconnecting it",4313
Usage text displayed,4314
Help text displayed,4315
File does not exist,4316
File is not a regular file,4317
File is not closed,4318
Checking EC block group,4319
"Status: ERROR, message: Exception message",4320
Status: OK,4321
All EC block group status: OK,4322
"Local namespace for <*> is https:<*>:<*>, clientAddr",4323
"Cannot get local namespace for <*>, clientAddr",4324
"Cannot get node mapping when resolving <*> at data_center_<*> from https:<*>:<*>, path, loc, clientAddr",4325
closing,4326
Forcing <*> to shutdown!,4327
Interrupted while waiting for <*> to terminate,4328
"NFS SYMLINK, target: <*> link: <*> namenodeId: <*> client: <*>.<*>.<*>.<*>",4329
"Exception, java.io.IOException: Operation failed",4330
Replica Cache file: <*> doesn't exist,4331
Replica Cache file: <*> has gone stale,4332
Replica Cache file: <*> cannot be deleted,4333
Successfully read replica from cache file : <*>,4334
Summary of operations loaded from edit log:,4335
Failed to add storage directory <*><*><*> for block pool pool-<*>,4336
loadBlockPoolSliceStorage: <*> upgrade tasks,4337
Failed to <*> storage directory <*><*><*> for block pool pool-<*>,4338
Incorrect configuration: namenode address dfs.namenode.service.rpc-address.nameservice<*> or dfs.namenode.rpc-address.nameservice<*> is not configured.,4339
Unknown nameservice: nameservice<*>,4340
checkDiskErrorAsync callback got <*> failed volumes: <*>,4341
"Retrying connect to namenode: https:<*>:<*>. Already retried <*> time(s); retry policy is RetryPolicy, delay <*>ms.",4342
Original exception is,4343
Could not find target position <*>,4344
Formatting journal <*> with nsid: <*>,4345
Allowed RPC access from hadoop_user at /<*>.<*>.<*>.<*>:<*> <*>,4346
Disallowed RPC access from <*> at <*> Not listed in dfs.cluster.administrators,4347
Allowed RPC access from flink_user at <*>.<*>.<*>.<*>,4348
Starting services required for active state,4349
Catching up to latest edits from old active before taking over writer role in edits logs,4350
Reprocessing replication and invalidation queues,4351
Will take over writing edit logs at txnid <*>,4352
"Lazy persist file scrubber is disabled, configured scrub interval is zero.",4353
Failed to list directory <*> Ignore the directory and continue.,4354
AuditEvent success: <*> operation: getXAttrs source: src,4355
"Clearing all the queues from StoragePolicySatisfier. So, user requests on satisfying block storages would be discarded.",4356
Recover failed close block_<*>,4357
"NextBlock call returned null. No valid block to copy. {<*>:<*>,<*>:<*>,<*>:<*>}",4358
Maximum error count exceeded. Error count: <*> Max error:<*>,4359
Failed to get number of live in maintenance nodes,4360
DFSStripedOutputStream does not support hsync. Caller should check StreamCapabilities before calling.,4361
"BlockRecoveryWorker: datanode<*> calls recoverBlock(blk_<*>, targets=<*>, newGenerationStamp=<*>, newBlock=blk_<*>, isStriped=false)",4362
Usernames not matched: name=user<*> != expected=user<*>,4363
"shutdownDatanode command received (upgrade=false). Shutting down Datanode..., forUpgrade",4364
Outputting <*> more corrupted nodes.,4365
datanode<*>:<*> was chosen by name node (favored=datanode<*>:<*>).,4366
These favored nodes were specified but not chosen: <*> Specified favored nodes: <*>,4367
Usage printed,4368
Configuration set,4369
Security login,4370
Instance created,4371
File does not exist: <*>,4372
Computed content summary for <*>,4373
Added yield count,4374
Unable to read transaction ids from the configured shared edits storage. Error: Input stream closed,4375
Getting exception while trying to determine if nameservice can use logical URI,4376
Couldn't create proxy provider <*>,4377
Getting exception while trying to determine if nameservice can use logical URI: java.lang.NullPointerException,4378
Allocated new BlockPoolId: pool-<*>,4379
Edit log tailer thread exited with an exception,4380
Cannot get StateStore records from the State Store,4381
Begin <*>,4382
saveNameSystemSection completed,4383
saveErasureCodingSection completed,4384
Begin saveInodes and Snapshots,4385
saveInodes and Snapshots completed,4386
saveSecretManagerSection completed,4387
saveCacheManagerSection completed,4388
blocks = <*>,4389
Waiting for volume reference to be released.,4390
Thread interrupted when waiting for volume reference to be released.,4391
Volume reference is released.,4392
"Failed to cache block with id <*>, pool pool-<*>: ReplicaInfo not found.",4393
"Failed to cache block with id <*>, pool pool-<*>: replica is not finalized; it is in state TRANSIENT.",4394
"Failed to cache block with id <*>, pool pool-<*>: volume not found.",4395
Caching not supported on block with id <*> since the volume is backed by RAM.,4396
LazyWriter failed to async persist RamDisk block pool id: pool-<*> block Id: <*>,4397
DIR* FSDirectory.unprotectedRenameTo: rename destination <*> <*> <*> <*>,4398
DIR* FSDirectory.unprotectedRenameTo: rename destination parent ... is a file.,4399
Loading cache for StateStore,4400
Registered cache was not found for StateStore,4401
BLOCK* processExtraRedundancyBlock: Postponing block_<*> since storage datanode<*> does not yet have up-to-date information.,4402
Exception writing block to mirror datanode<*>:<*>,4403
"Block: blk_<*>, Expected Replicas: <*>, live replicas: <*>, corrupt replicas: <*>, decommissioned replicas: <*>, decommissioning replicas: <*>, maintenance replicas: <*>, live entering maintenance replicas: <*>, replicas on stale nodes: <*>, readonly replicas: <*>, excess replicas: <*>, Is Open File: false, Datanodes having this block: <*>, Current Datanode: datanode<*>, Is current datanode decommissioning: false, Is current datanode entering maintenance: false",4404
User hadoop_user performed READ operation on file <*> from IP <*>.<*>.<*>.<*>,4405
"""<*>hdfs:<*>"" instead.",4406
Disk Balancer - Source and destination volumes are same: a<*>b<*>c<*>d<*>-e<*>f<*>-<*>-<*>-<*>abcdef,4407
RPC ids logged with op,4408
Edit operation logged,4409
nextTcpPeer: reusing existing peer datanode<*>:<*>,4410
nextTcpPeer: created newConnectedPeer datanode<*>:<*>,4411
nextTcpPeer: failed to create newConnectedPeer connected to datanode<*>:<*>,4412
Created storage ID ds-<*>-<*>-<*>-<*>,4413
Reading properties file from <*>,4414
Incompatible namespaceIDs in <*>: namenode namespaceID = <*>; datanode namespaceID = <*>,4415
Incompatible clusterIDs in <*>: namenode clusterID = cluster-<*>; datanode clusterID = cluster-<*>,4416
Upgrading properties for federation,4417
Performing upgrade before federation,4418
BUG: The stored LV = <*> is newer than the supported LV = -<*>,4419
Unable to start log segment txid at currentInProgress: The file already exists,4420
Closing <*> metrics,4421
Shutting down Router metrics,4422
Closing RBF metrics,4423
Closing Namenode metrics,4424
Setting dfs.namenode.rpc-address.ns<*> to namenode<*>:<*>,4425
Setting dfs.namenode.servicerpc-address.ns<*> to namenode<*>:<*>,4426
Could not find a target for file,4427
Starting up re-encrypt thread with interval=<*> millisecond.,4428
Executing re-encrypt commands on zone zone_<*>. Current <*>,4429
"Re-encryption caught exception, will retry",4430
IOException caught when re-encrypting zone zone_<*>,4431
Re-encrypt handler interrupted. Exiting,4432
Zone zone_<*> will retry re-encryption,4433
"No class configured for hdfs, dfs.nameservices is empty",4434
DataNode overwriting downstream QOP: MutualAuth,4435
Retrieved trimmed value for namenode id,4436
Suffix IDs retrieved successfully,4437
Configuration must be suffixed with nameservice and namenode ID for HA configuration,4438
trying to create a remote block reader from the UNIX domain socket at <*>,4439
One of the nodes is a null pointer,4440
NFS SETATTR fileHandle: <*> client: nfsclient<*>,4441
Exiting Mover due to an exception,4442
"Cannot get locations for <*>, java.io.IOException.",4443
checkStreamers: <*>,4444
healthy streamer count=<*>,4445
original failed streamers:<*>,4446
newly failed streamers:<*>,4447
Failed: the number of failed blocks = <*> > the number of parity blocks = <*>,4448
Replica replica_id_<*> was not found in the VolumeMap for volume volume_id_<*>,4449
start scanning block block_<*>,4450
I<*> error while finding block block_<*> on volume volume_id_<*>,4451
"Processing batched re-encryption for zone zone<*>, batch size <*>, start:<*>, zoneNodeId, <*>, <*>",4452
"Failed to re-encrypting one batch of <*> edeks from KMS, time consumed: <*>ms, start: <*>, result, <*>, <*>ms, <*>",4453
"Completed re-encrypting one batch of <*> edeks from KMS, time consumed: <*>ms, start: <*>, result, <*>, <*>ms, <*>",4454
Could not find a target for file <*> with favored node datanode<*>,4455
"stage=DATA_TRANSFER, BlockOutputStream@<*>",4456
Thread interrupted,4457
"BlockSize <*> < lastByteOffsetInBlock, BlockOutputStream@<*>, datanode<*>:<*>",4458
Failed to set keys,4459
InterruptedException in block key updater thread,4460
Exception in block key updater thread,4461
DIR* FSDirectory.unprotectedRenameTo: rename source <*> <*> <*> <*>,4462
Restoring <*> to <*>,4463
Refreshing call queue.,4464
"Cannot rename <*> to <*>,java.io.IOException: Permission denied",4465
Waiting to executor service terminated duration <*>ms.,4466
Interrupted waiting for executor terminated.,4467
Stopping periodic service NameNodePeriodicServices,4468
"Skipping statistical outlier detection as we don't have latency data for enough resources. Have <*>, need at least <*>",4469
"getOutliers: List=<*>, MedianLatency=<*>ms, MedianAbsoluteDeviation=<*>ms, upperLimitLatency=<*>ms",4470
Processing SnapshotDiffSection,4471
Checkpoint Period :<*> secs (<*> min),4472
Log Size Trigger :<*> txns,4473
trySendErrorReport encountered RemoteException errorMessage: Disk full on <*><*> errorCode: DISK_FULL,4474
Removed blocks associated with storage hdd-pool-<*> from DataNode datanode<*>,4475
"error saving data to disk, iteration <*>, java.io.IOException: Disk full.",4476
File system operation failed due to I<*> error,4477
Beginning to copy stream EditLogInputStream to shared edits,4478
copying op: OP_ADD,4479
ending log segment because of END_LOG_SEGMENT op in EditLogInputStream,4480
ending log segment because of end of stream in EditLogInputStream,4481
Exception in closing input_stream,4482
Triggering log roll on remote NameNode,4483
"Unable to trigger a roll of the active NN, e",4484
Unable to finish rolling edits in <*> ms,4485
Interrupted while waiting for reconstructionQueueInitializer. Returning..,4486
"Namenode is in safemode, skipping scrubbing of corrupted lazy-persist files.",4487
LazyPersistFileScrubber encountered an exception while scanning for lazyPersist files with missing blocks. Scanning will retry in <*> seconds.,4488
"LazyPersistFileScrubber was interrupted, exiting",4489
Attempting operation: removeDefaultAcl,4490
Audit event failed: AccessControlException,4491
void <*>,4492
Audit event succeeded: removeDefaultAcl,4493
void checkNameNodeSafeMode,4494
boolean isInSafeMode,4495
