EventTemplate,AdldEventId
The value of DFS_NAMENODE_AVAILABLE_SPACE_BLOCK_PLACEMENT_POLICY_BALANCED_SPACE_PREFERENCE_FRACTION_KEY is greater than <*>.<*> but should be in the range <*>.<*> - <*>.<*>,2820
The value of DFS_NAMENODE_AVAILABLE_SPACE_BLOCK_PLACEMENT_POLICY_BALANCED_SPACE_PREFERENCE_FRACTION_KEY is less than <*>.<*> so datanodes with more used percent will receive more block allocations.,2821
"The value of DFS_NAMENODE_AVAILABLE_SPACE_BLOCK_PLACEMENT_POLICY_BALANCED_SPACE_TOLERANCE_KEY is invalid, Current value is <*>, Default value DFS_NAMENODE_AVAILABLE_SPACE_BLOCK_PLACEMENT_POLICY_BALANCED_SPACE_TOLERANCE_DEFAULT will be used instead.",2822
Decommissioning complete for node namenode<*>,2823
Storage storage<*> failed.,2824
Successfully loaded <*> inodes,2825
Adding snapshot,2826
Access token was invalid when connecting to https:<*>:<*>: org.apache.hadoop.security.token.SecretManager$InvalidToken,2827
Editing log with SetStoragePolicyOp,2828
VolumeScanner thread starting.,2829
VolumeScanner wait for <*> milliseconds,2830
VolumeScanner exiting because of <*>,2831
VolumeScanner exiting.,2832
Configuration key fs.checkpoint.size is deprecated! Ignoring... Instead please specify a value for dfs.namenode.checkpoint.size,2833
Cluster URI : hdfs:<*>:<*>,2834
scheme : hdfs,2835
Creating a JsonNodeConnector,2836
Unexpected exception java.net.ConnectException proxying getBlockLocations to https:<*><*>:<*>,2837
modifyDirective of directive_<*> successfully applied <*>,2838
modifyDirective of directive_<*> failed: Replication validation failed.,2839
Generating block reports,2840
"Cannot build location, <*> not a child of <*>",2841
PendingReconstructionMonitor checking Q,2842
PendingReconstructionMonitor timed out <*>,2843
Sleeping in the re-encrypt handler for unit test.,2844
Continuing re-encrypt handler after pausing.,2845
All specified directories have failed to load.,2846
Finished executing getErasureCodingPolicy for path <*>,2847
Loading filter handler com.example.CustomFilter,2848
Failed to initialize handler com.example.CustomFilter,2849
Loading filter handler com.example.AnotherFilter,2850
Updated disk outliers.,2851
Processing <*> messages from DataNodes that were previously queued during standby state,2852
Using a threshold of <*>,2853
Will run the balancer even during an ongoing HDFS upgrade,2854
Loading file: <*>,2855
Cannot open read stream for record <*>,2856
"Satisifer Q - outstanding limit:<*>, current size:<*>",2857
"Outstanding satisfier queue limit: <*> exceeded, try later!",2858
State transition ACTIVE -> IDLE,2859
"Failed to analyze storage directories for block pool pool-<*>, caused by java.io.IOException: Disk failure",2860
"Created new DT for hdfs:<*><*>:<*>, token.getService()",2861
"logAuditEvent(true, <*>, <*> null, auditStat)",2862
"logAuditEvent(false, <*>, <*>",2863
Could not sync enough journals to persistent storage due to No journals available to flush. Unsynced transactions: transactions,2864
Incompatible namespaceIDs: Namenode namespaceID = <*>; DataNode node namespaceID = <*>,2865
Successfully saved namespace for preparing rolling upgrade.,2866
Attempting operation getFileInfo as user datanode_user,2867
Retrying operation getFileInfo after encountering a connection error,2868
Deleting file <*>,2869
Snapshot snap<*> deleted successfully.,2870
Unsupported operation RENAME is not supported,2871
NN is transitioning from active to standby and FSEditLog is closed -- could not read edits,2872
Skipping jas + jas + since it's disabled,2873
Fast-forwarding stream...,2874
Active Volumes : <*>,2875
Datanode Volume Report,2876
Finalizing upgrade for journal <*> cur LV = -<*>; cur CTime = <*>,2877
Trying to construct a BlockReaderLocal for short-circuit reads.,2878
<*> is not usable for short circuit; giving up on BlockReaderLocal.,2879
Got InvalidToken exception while trying to construct BlockReaderLocal via <*>,2880
Failed to get ShortCircuitReplica. Cannot construct BlockReaderLocal via <*>,2881
"Recovering persistent memory cache for block block_<*>, path = <*>, address = <*>x<*>, length = <*>, key, path, addr, length",2882
Failed to recover the block cache_file.dat in persistent storage.,2883
"Cancelling plan on datanode<*> failed. Result: FAILURE, Message: Unable to cancel plan, datanode<*>, FAILURE, Unable to cancel plan",2884
Exception while checking whether encryption zone is supported,2885
Exception in checking the encryption zone for the path,2886
Reference trace incremented,2887
Scanner volume report: null,2888
"Do nothing, dump is disabled.",2889
Asking dumper to dump...,2890
"Audit: operation=getFileInfo, src=<*>, user=hdfs, access=READ, client=<*>.<*>.<*>.<*>",2891
"BLOCK* BlockUnderConstructionFeature.initializeBlockRecovery: No blocks found, lease removed.",2892
"BLOCK* {this} recovery started, primary={primary}",2893
Directory created,2894
Invocation to for timed out,2895
Canot execute in :,2896
Not enough client threads <*>/<*>,2897
Unexpected error while invoking API:,2898
"this + blocksToReceive=<*>, scheduledSize=<*>, srcBlocks#=<*>",2899
Exception while getting reportedBlock list,2900
Failed to find a pending move for <*> ms. Skipping this,2901
The maximum iteration time (<*> seconds) has been reached. Stopping this,2902
Connecting to datanode datanode<*> addr=<*>.<*>.<*>.<*>:<*>,2903
Registered FederationRPCMBean: org.apache.hadoop.hdfs.server.federation.router.Router,2904
Invocation to datanode<*>:<*> for readBlock timed out,2905
Canot execute getBlockLocation in datanode<*>: Connection refused (Connection refused),2906
Number of suppressed read-lock reports: <*> via thread-<*>,2907
Longest read-lock held at resource_<*> for <*>ms via thread-<*>,2908
Exception caught in channelRead<*>,2909
getFileInfo: masked=true,2910
Evicting block replica_id_<*>,2911
Failed to delete <*> file,2912
Unable to get HomeDirectory from original File System,2913
Audit: allowed=true ugi=hadoop_user (auth:KERBEROS) ip=/<*>.<*>.<*>.<*> op=disallowSnapshot src=<*> dst=null perm=null,2914
Block pool pool-<*> not found,2915
"<*> data directory doesn't exist, creating it",2916
Cannot create data directory <*>,2917
Loading <*> INodes.,2918
Reading empty packet at end of read,2919
range.getMin()=<*> nextOffset=<*>,2920
The next sequential write has not arrived yet,2921
Remove write <*> which is already written from the list,2922
"Got an overlapping write <*>, nextOffset=<*>. Remove and trim it",2923
Change nextOffset (after trim) to <*>,2924
Remove write <*> from the list,2925
Change nextOffset to <*>,2926
"The async write task has no pending writes, fileId: <*>",2927
"Stopped the writer: DataStreamer, datanode<*>:<*>",2928
TrackID: <*><*>.txt becomes timed out and moved to needed retries queue for next iteration.,2929
Storage directory with location <*><*><*> does not exist,2930
Storage directory with location <*><*><*> is not formatted for namespace <*>. Formatting...,2931
addSymlink: failed to add <*>,2932
addSymlink: <*> is added,2933
Too many children.,2934
BUG: unexpected exception java.lang.IllegalArgumentException,2935
ERROR in verifyINodeName java.lang.IllegalArgumentException,2936
"child: null, posixAclInheritanceEnabled: false, modes: null",2937
: no parent default ACL to inherit,2938
Exception while reading from block block_<*> at datanode<*>:<*>,2939
Found Checksum error for block block_<*> at datanode<*>:<*>,2940
"SPS hint already removed for the inodeId:<*>. Ignoring exception:java.io.IOException: Operation failed, inodeId, Operation failed",2941
Stopping the HTTP server,2942
Will remove files: <*>,2943
NativeIO.chmod error (<*>): Permission denied,2944
Cancel delegation token,2945
Cancel request by data_user,2946
"Will fetch a new encryption key and retry, encryption key was invalid when connecting to datanode<*>",2947
fetchBlockByteRange(). Got a checksum exception for <*> at blk_<*>:<*> from datanode<*>,2948
Connection failure: Failed to connect to datanode<*> for file <*> for block blk_<*>,2949
Creating remote user: data_user,2950
checkpoint: error message,2951
"<*> limit has been reached, re-queueing <*> nodes which are dead while in Decommission In Progress., dfs.namenode.decommission.max-concurrent-tracked-nodes, <*>",2952
Registration rejected by namenode<*>.example.com:<*>. Shutting down.,2953
Name-node is not active. Shutting down.,2954
Name-node namenode<*>.example.com:<*> is not active. Shutting down.,2955
Registration rejected by NameNode. Shutting down.,2956
Dumper woke up,2957
"Dumper is interrupted, dumpFilePath = <*><*>",2958
Dumper checking OpenFileCtx activeState: true enabledDump: true,2959
Dumper got Throwable. dumpFilePath: <*><*>,2960
"Got IOException while trying to validate header of editlog_<*>. Skipping., java.io.IOException",2961
"Re-encryption updater throttling expect: <*>, actual: <*>, throttleTimerAll: <*>",2962
Caught interrupted exception,2963
Checking NN startup,2964
Checking operation category,2965
Getting EditLog,2966
Safe mode is now <*>,2967
Safe mode status: false,2968
Unexpected safe mode action,2969
Starting SyncJournal daemon for journal hdfs-journal for NameSpaceId <*>,2970
block is already in the recovery queue,2971
<*> is corrupt but has no associated node.,2972
Mis-replicated blocks that have been postponed:,2973
java.io.IOException: Stream closed,2974
Checksum mismatch for block blk_<*> at offset <*>,2975
Replacing bad block on datanode<*> with good block on datanode<*>,2976
BLOCK* allocate block_<*> for <*>,2977
DFS Read,2978
Found corruption while reading hdd_pool_<*>. Error repairing corrupt blocks. Bad blocks remain.,2979
Sending the cached reply to retransmitted request <*>,2980
"Retransmitted request, transaction still in progress <*>",2981
"No sync response, expect an async response for request XID=<*>",2982
"Wrong RPC AUTH flavor, AUTH_KERBEROS is not AUTH_SYS or RPCSEC_GSS.",2983
copyBlocksToLostFound: error processing <*><*>,2984
Fsck: can't copy the remains of <*><*> to <*>+found because <*>+found<*><*> already exists.,2985
Fsck: could not copy block blk_<*> to <*>+found<*><*>,2986
Fsck: there were errors copying the remains of the corrupted file <*><*> to <*>+found,2987
Fsck: copied the remains of the corrupted file <*><*> to <*>+found,2988
Loading the INodeDirectory section in parallel with <*> sub-sections,2989
Interrupted waiting for countdown latch,2990
<*> exceptions occurred loading INodeDirectories,2991
Completed loading all INodeDirectory sub-sections,2992
Reconfiguring dfs.datanode.du.interval to <*>,2993
RECONFIGURE* changed dfs.datanode.du.interval to <*>,2994
Reconfiguring dfs.datanode.balance.bandwidthPerSec to <*>,2995
RECONFIGURE* changed dfs.datanode.balance.bandwidthPerSec to <*>,2996
Checked operation WRITE,2997
Getting locations for path,2998
Invoking method concurrently,2999
Sanity checks completed,3000
Fetching block byte range,3001
DFSInputStream has been closed already,3002
"closing file <*>, but there are still unreleased ByteBuffers allocated by read(). Please release java.nio.DirectByteBuffer<*>.",3003
No data exists for block blk_<*>,3004
Failed to open path <*>: Permission denied,3005
The list of corrupt files under path <*> are:,3006
line,3007
The filesystem under path <*> has no CORRUPT files,3008
The filesystem under path <*> has <*> CORRUPT files,3009
"Checksum error in block blk_<*> from /<*>.<*>.<*>.<*>:<*>, <*>",3010
report corrupt block blk_<*> from datanode datanode<*> to namenode,3011
Failed to report bad block blk_<*> from datanode datanode<*> to namenode,3012
Successfully got block locations,3013
Failed to update the access time of <*>,3014
Safe mode exception encountered,3015
Block blk_<*> does not have a metafile!,3016
Add user hdfs to the list that will bypass external attribute provider.,3017
Need to move <*>MB to make the cluster balanced.,3018
Will move <*>MB in this iteration for datanode<*>,3019
Total target DataNodes in this iteration: <*>,3020
"Balancer exiting as upgrade is not finalized, please finalize the HDFS upgrade before running the balancer.",3021
"Interrupted Exception while waiting to join sps thread, ignoring it",3022
Attempted to cache data of length <*> with newStartTxn -<*> and newEndTxn <*>,3023
Unable to save new edits <*> due to exception when updating to new layout version <*>,3024
"A single batch of edits was too large to fit into the cache: startTxn = <*>, endTxn = <*>, input length = <*>. The capacity of the cache (<*>MB) must be increased for it to work properly (current capacity <*>). Cache is now empty.",3025
Initializing edits cache starting from txn ID <*>,3026
Edits cache is out of sync; looked for next txn id at <*> but got start txn id for cache put request at <*>. Reinitializing at new request.,3027
getCurrentEditLogTxid,3028
"Updating re-encryption checkpoint with completed task. last: block_<*>, size: <*>",3029
"Failed to update re-encrypted progress to xattr for zone <*>, key: task_<*>",3030
Removed re-encryption tracker for zone <*> because it completed with <*> tasks.,3031
Fix Quota src=<*> dst=hdfs:<*><*>:<*> oldQuota=<*>/<*> newQuota=<*>/<*>,3032
Fix Quota src=<*> dst=hdfs:<*><*>:<*> type=DISK oldQuota=<*> newQuota=<*>,3033
Purging no-longer needed file <*><*>.dat,3034
Unable to delete no-longer-needed data <*><*>.dat,3035
Exception in doCheckpoint,3036
Merging failed <*> times.,3037
Throwable Exception in doCheckpoint,3038
"start process datanode<*> error, DataStreamer@<*>, this",3039
Error recovering pipeline for writing block blk_<*>. Already retried <*> times for the same packet.,3040
Enabled trash for bpid data_pool_<*>,3041
For namenode using https:<*>:<*>,3042
BPServiceActor ( BP-<*>-<*>.<*>.<*>.<*>-<*> ) processing queued messages. Action item: BPServiceActorAction@<*>a<*>a<*>,3043
Sending heartbeat with <*> storage reports from service actor: BPServiceActor@<*>a<*>c<*>f,3044
IOException in offerService,3045
Finalizing upgrade for storage directory <*>\n cur LV = -<*>; cur CTime = <*>,3046
Finalize upgrade for <*> is complete,3047
Finalize upgrade for <*> failed,3048
NameSystem.startFile: added src inode id holder,3049
Disk Balancer - Unable to find source volume: <*><*>,3050
Disk Balancer - Unable to support transient storage type.,3051
No block pools found on volume. volume : <*><*>. Exiting.,3052
Moved block with size <*> from <*><*> to <*><*>,3053
Error reported on file <*> ... exiting,3054
"Initializing shared journals for READ, already open for READ",3055
"closed MappedByteBuffer, this, local_file.data",3056
closed hdd_pool_<*> flink_cluster this suffix,3057
"SASL client doing <*> handshake for addr = datanode<*>:<*>, datanodeId = datanode<*>:<*>",3058
"SASL client skipping handshake in unsecured configuration for addr = datanode<*>:<*>, datanodeId = datanode<*>:<*>",3059
"SASL client skipping handshake in secured configuration with <*> <*> for addr = datanode<*>:<*>, datanodeId = datanode<*>:<*>",3060
"SASL client skipping handshake in secured configuration with no SASL protection configured for addr = datanode<*>:<*>, datanodeId = datanode<*>:<*>",3061
Cannot find BPOfferService for reporting block receiving for bpid=BP-<*>-datanode<*>-<*>,3062
Disk Balancer - Source and destination volumes are same: <*>,3063
error closing DomainPeerServer: java.io.IOException: Connection reset,3064
Invalid tagName: invalid_tag,3065
"NameNode is being shutdown, exit SafeModeMonitor thread",3066
Decreasing replication from <*> to <*> for <*>,3067
Increasing replication from <*> to <*> for <*>,3068
Replication remains unchanged at <*> for <*>,3069
Cannot refresh mount table: state store not available,3070
Failed to initialize storage directory <*><*>. Exception details: Invalid directory permissions,3071
trying to create ShortCircuitReplicaInfo.,3072
allocShmSlot used up our previous socket...,3073
closing stale domain peer hdfs_peer_<*>,3074
this + I<*> error requesting file descriptors. Disabling domain socket <*>,3075
Start to update quota cache.,3076
"Unable to get quota usage for <*>, java.io.IOException",3077
Step DELEGATION_TOKENS started,3078
End step DELEGATION_TOKENS,3079
"Invalidated <*> extra redundancy blocks on datanode<*> after it is in service, <*>",3080
Creating new mount table entry,3081
Mount point added successfully <*>,3082
Updating existing mount table entry,3083
Mount point updated successfully,3084
<*> are unavailable and all striping blocks on them are lost. IgnoredNodes = <*>,3085
Failed to get number of decommissioning nodes,3086
NFS RENAME from: <*> to: <*> client: nfs_client,3087
Invalid RENAME request,3088
Failed to resolve network location for datanode,3089
Failed to read topology table. DEFAULT_RACK will be used for all nodes.,3090
NET_TOPOLOGY_TABLE_MAPPING_FILE_KEY not configured.,3091
The quota system is disabled.,3092
"Top limit input is not numeric, using default top value <*>.",3093
"No top limit specified, using default top value <*>.",3094
Could not get block locations. Source file <*> - Aborting...,3095
A checkpoint was triggered but the Standby Node has not received any transactions since the last checkpoint at txid <*>. Skipping...,3096
Exception encountered while saving legacy OIV image; continuing with other checkpointing steps,3097
Cannot locate eligible NNs for pool-<*>,3098
"Cannot get active NN for pool-<*>, State Store unavailable",3099
"deleteBlockPool command received for block pool data_pool_<*>, force=true",3100
Failed to get groups for user flink_cluster,3101
"The block pool data_pool_<*> is still running, cannot be deleted.",3102
Overwriting existing file <*><*>,3103
Unable to download file <*><*>,3104
"CommandProcessor encountered fatal exception and exit., getProcessorName(), java.lang.Exception",3105
Ending command processor service for: command_processor_<*>,3106
Checking operation createSnapshot,3107
Getting permission checker,3108
Setting operation type to CREATE,3109
Acquiring write lock,3110
Checking namenode safemode status,3111
Creating snapshot,3112
Releasing write lock,3113
Logging audit event for createSnapshot operation,3114
Starting to add to replicas map,3115
Processing directory file,3116
"File is not a block filename, skipping.",3117
Error adding replica to map,3118
Cipher suite AES_CTR_NOPADDING is not supported,3119
Loading the INode section in parallel with <*> sub-sections,3120
Completed loading all INode sections. Loaded <*> inodes.,3121
<*> exceptions occurred loading INodes,3122
Performing upgrade of storage directory <*>,3123
"Unable to rename temp to previous for <*>, java.io.IOException",3124
"stopMaintenance: Node datanode-<*> in <*>, nothing to do.",3125
DataNode overwriting downstream QOP,3126
"Client using encryption algorithm AES<*>, AES<*>",3127
Exception shutting down web server,3128
"Got journal, state = IN_SYNC; firstTxId = <*>; numTxns = <*>",3129
"Got journal, state = DROP_UNTIL_NEXT_ROLL; firstTxId = <*>; numTxns = <*>",3130
"Got journal, state = JOURNAL_ONLY; firstTxId = <*>; numTxns = <*>",3131
"Got journal, state = UNKNOWN; firstTxId = <*>; numTxns = <*>",3132
Failed to start storage policy satisfier.,3133
createStartupShutdownMessage,3134
Failed to delete idPath,3135
Namenode startup check completed successfully.,3136
Attempting to retrieve an additional block.,3137
"Located block is null, indicating no additional block found.",3138
Cleanup with logger,3139
"Invalid argument, data size is less than <*> in request",3140
requested offset=<*> and current filesize=<*>,3141
Error writing to fileId <*> at offset <*> and length <*>,3142
*DIR* NameNode.append: file <*> for hadoop_client at datanode<*>,3143
Incompatible namespace ID. Expected <*> but found <*>.,3144
Reported NameNode version <*> does not match DataNode version <*> but is within acceptable limits. Note: This is normal during a rolling upgrade.,3145
Invalid MKDIR request,3146
NFS MKDIR dirHandle: <*>x<*> filename: new_directory client: <*>.<*>.<*>.<*>,3147
Setting file size is not supported when mkdir: <*> in dirHandle <*>x<*>,3148
"Audit success ugi=datanode, ip=/<*>.<*>.<*>.<*>, cmd=getFileInfo, src=<*>, dst=null, perm=null, proto=rpc",3149
Already enabled scanning on block pool pool-<*>,3150
Loaded block iterator for pool-<*>,3151
Failed to load block iterator: File not found,3152
Failed to load block iterator.,3153
Cannot find BPOfferService for reporting block received + for bpid=bp-<*>-<*>.<*>.<*>.<*>-<*>,3154
Beginning handshake with namenode<*>,3155
"RemoteException in register, java.rmi.RemoteException",3156
Problem connecting to server: https:<*>:<*>: Connection refused (Connection refused),3157
Problem connecting to server: https:<*>:<*>,3158
Successfully registered with namenode<*>,3159
DN shut down before block pool registered,3160
"Auditing operation operation=unsetStoragePolicy, src=<*>, dst=null, perm=null, proto=rpc, user=hdfs, group=hdfs, access=WRITE, clientAddress=/<*>.<*>.<*>.<*>, callId=<*>",3161
Number of suppressed write-lock reports: <*> Longest write-lock held at <*>:<*>:<*> for <*>ms via java.lang.Thread.getStackTrace() Total suppressed write-lock held time: <*>,3162
"An error occurred while reflecting the event in top service, event: (cmd=unsetStoragePolicy,userName=hdfs)",3163
Formatting block pool pool-<*> directory <*><*><*>,3164
Setting bandwidth to <*>,3165
Setting max error to <*>,3166
handleVolumeFailures done with empty unhealthyVolumes <*>,3167
"Error occurred when removing unhealthy storage dirs, java.io.IOException",3168
DataNode failed volumes: <*> <*>,3169
DataNode failed volumes: <*>,3170
handleVolumeFailures done with empty unhealthyVolumes,3171
DIR* FSDirectory.addBlock: <*> with block_<*> block is added to the in-memory file system,3172
"Exception , java.lang.InterruptedException",3173
All volumes are within the configured free space balance threshold. Selecting volume for write of block size <*>,3174
Volumes are imbalanced. Selecting volume from high available space volumes for write of block size <*>,3175
Volumes are imbalanced. Selecting volume from low available space volumes for write of block size <*>,3176
"can<*>t skipping checksums, and the block is not mlocked.",3177
Cannot find block info for block blk_<*>,3178
Removing lazyPersist file <*> with no replicas.,3179
"ShortCircuitCache: about to release ShortCircuitCache.this, slot-<*>",3180
"ShortCircuitCache: released ShortCircuitCache.this, slot-<*>",3181
ShortCircuitCache: failed to release short-circuit shared memory slot ...,3182
BLOCK* getAdditionalBlock: <*> inodeId <*> for replica<*>.example.com,3183
Number of suppressed read-lock reports: <*> Longest read-lock held at <*>:<*>:<*> for <*>ms via stacktrace,3184
"DeadNode detection is not enabled or given block Block_<*>_<*> is null, skip to remove node.",3185
Default name service is disabled. <*>,3186
Default name service is not set. <*>,3187
"Default name service: hdfs:<*><*>:<*>, enabled to read or write",3188
Failed to fetch TopUser metrics,3189
DIR* FSDirectory.unprotectedRenameTo: Rename destination <*> is a directory or file under source <*>,3190
Mount tree initialization failed with the reason => java.io.IOException: Mount point not found. Falling back to regular DFS initialization. Please re-initialize the fs after updating mount point.,3191
Saving image file <*> using GZIP,3192
Image file <*> of size <*> bytes saved in <*>.<*> seconds.,3193
"opWriteBlock: stage=DATA, clientname=DataNodeClient block=blk_<*>_<*> newGs=<*>, bytesRcvd=<*> targets=<*>; pipelineSize=<*>, srcDataNode=datanode<*>, pinning=false",3194
"isDatanode=false, isClient=true, isTransfer=true",3195
writeBlock receive buf size <*> tcp no delay true,3196
Receiving block blk_<*>_<*> src: /<*>.<*>.<*>.<*>:<*> dest: /<*>.<*>.<*>.<*>:<*>,3197
"Add namenode<*> to local dead nodes, previously was namenode<*>.",3198
There is no pending items to satisfy the given path inodeId:<*>,3199
Starting a new transaction,3200
Writing raw edit log data,3201
Performing edit transaction,3202
Error parsing command-line options:,3203
Can only specify -delimiter with Delimited processor,3204
key = <*> (default=<*>),3205
Space available on volume <*> is <*>,3206
"Space available on volume <*> is <*>, which is below the configured reserved amount <*>",3207
"Failed to reconstruct striped block Block{blockId=<*>, numBytes=<*>, genStamp=<*>, replication=<*>}, due to insufficient datanodes.<*>",3208
"No missing internal block. Skip reconstruction for task: ReconstructionTask{targetBlock=Block{blockId=<*>, numBytes=<*>, genStamp=<*>, replication=<*>}, targets=<*>}<*>",3209
"Failed to reconstruct striped block Block{blockId=<*>, numBytes=<*>, genStamp=<*>, replication=<*>}, due to java.io.IOException: Disk full",3210
"Not scheduling suspect block blk_<*> for rescanning, because this volume scanner is stopping.",3211
"Not scheduling suspect block blk_<*> for rescanning, because we rescanned it recently.",3212
Suspect block blk_<*> is already queued for rescanning.,3213
Scheduling suspect block blk_<*> for rescanning.,3214
Real capacity is negative. This usually points to some kind of mis-configuration. Capacity : -<*> Reserved : <*> realCap = capacity - reserved = -<*>. Skipping this volume from all processing. type : DISK id :volume_<*>,3215
selectStreamingInputStream manifests: {},3216
Found endTxId <*>,3217
Safemode status retrieved successfully.,3218
Client trace information logged,3219
Received block blk_<*> size <*> from <*>,3220
Using codec: GzipCodec,3221
Created raw decoder for GzipCodec,3222
New instance created <*>,3223
Checkpoint failed,3224
Unable to rename checkpoint in StorageDirectory: IOException,3225
"The given interval for marking stale datanode = <*>ms, which is less than <*>ms heartbeat intervals. This may cause too frequent changes of stale states of DataNodes since a heartbeat msg may be missing due to temporary short-term failures. Reset stale interval to <*>ms.",3226
"The given interval for marking stale datanode = <*>ms, which is larger than heartbeat expire interval <*>ms.",3227
Using default data node port : datanode<*>:<*>,3228
