EventTemplate,AdldEventId
Receiving block <*> src: /<*> dest: /<*>,1
BLOCK* NameSystem.allocateBlock:<*>,2
PacketResponder <*> for block <*> terminating,3
Received block <*> of size <*> from /<*>,4
BLOCK* NameSystem.addStoredBlock: blockMap updated: <*> is added to <*> size <*>,5
Received block <*> src: /<*> dest: /<*> of size <*>,6
<*>:Transmitted block <*> to /<*>,7
<*> Starting thread to transfer block <*> to <*>,8
BLOCK* ask <*> to replicate <*> to datanode(s) <*>,9
<*> Served block <*> to /<*>,10
Verification succeeded for <*>,11
writeBlock <*> received exception <*>,12
PacketResponder <*> <*> Exception <*>,13
Deleting block <*> file <*>,14
Receiving empty packet for block <*>,15
Exception in receiveBlock for block <*> <*>,16
BLOCK* NameSystem.addStoredBlock: Redundant addStoredBlock request received for <*> on <*> size <*>,17
PacketResponder <*> for block <*> Interrupted.,18
Changing block file offset of block <*> from <*> to <*> meta file offset to <*>,19
Sorting located striped block,20
Sorting located block,21
Encountered exception loading fsimage,22
Finished loading FSImage in <*> msecs,23
Refresh super user groups configuration <*> for namenode<*>:<*>,24
Refresh super user groups configuration successful,25
Refresh superuser groups configuration in Router,26
"Proxying operation: refreshSuperUserGroupsConfiguration, refreshSuperUserGroupsConfiguration",27
Operation check performed,28
Acquired locations for path <*>,29
Concurrent invocation initiated,30
Sequential invocation initiated,31
No shared edits directory configured for namespace ns-<*> namenode namenode<*>,32
Could not initialize shared edits dir,33
Fetched <*>MB block from namenode<*>,34
Access denied to path <*>,35
Getting groups for user hadoop_user,36
Failed to delete <*> file <*><*>,37
Rename operation succeeded for path <*>,38
Rename operation completed successfully on namenode<*>,39
Stopping HTTP server on port <*>,40
HTTP server stopped successfully,41
Service stopped successfully,42
There are no pending or blocks yet to be processed,43
There are <*> blocks pending replication and the limit is <*>. A further <*> blocks are waiting to be processed. The replication queue currently has <*> blocks,44
<*> blocks are now pending replication,45
Sent total: <*>MB,46
Connection closed by client,47
SIMULATING A CORRUPT BYTE IN IMAGE TRANSFER!,48
Cannot create record type <*> from <*>: Invalid format,49
"Cannot get data for <*> at <*>, cleaning corrupted data",50
Cannot get <*> for <*>: <*> <*>,51
Executed writeInt with value <*>,52
Saved all keys to <*>,53
Saved current tokens to <*>,54
Audit log <*> for operation listSnapshottableDirectory,55
getUGI is returning: hadoop_user,56
Unexpectedly <*> <*> on <*><*>,57
Truncate operation initialized for path <*>,58
Client <*> set to <*>,59
New length set to <*> bytes,60
Timestamp set to <*>,61
Truncate block set to block-<*>,62
Edit logged successfully,63
"Upstream service is down, skipping the sps work.",64
Failed to satisfy the policy after retries. Removing inode from the queue.,65
Block analysis <*> for the file id:<*>.,66
Adding to attempt monitor queue for the storage movement attempt finished report.,67
Adding trackID:<*> for the file id:<*> back to retry queue as none of the blocks found its eligible targets.,68
Adding trackID:<*> for the file id:<*> back to retry queue as some of the blocks are low redundant.,69
Adding trackID:<*> for the file id:<*> back to retry queue as some of the blocks movement failed.,70
"So, Cleaning up the Xattrs.",71
Namenode is in safemode. It will retry again.,72
Exception during StoragePolicySatisfier execution - will continue next cycle.,73
Stopping StoragePolicySatisfier.,74
StoragePolicySatisfier thread received runtime exception.,75
Select counter statement: SELECT * FROM counter_table,76
Counter table not initialized: counter_table,77
Reading <*>MB block from namenode<*>,78
Chunk is instance of LastHttpContent,79
Releasing DFS resources,80
Setting block metadata,81
Adding listener for block completion,82
Failed to <*> <*> <*> due to IOException,83
Exception caught and handled,84
Chunk is not instance of LastHttpContent,85
"Exception in channel handler, cause",86
Removed default ACL for path <*>,87
Successfully processed removeDefaultAcl request,88
Proxying operation,89
Block <*> moved from <*> to <*>,90
Source storage type: SSD,91
Target storage type: HDD,92
Block movement attempt completed successfully,93
Failed to connect with namenode,94
About to load edits: <*>,95
Reading <*><*> expecting start txid #<*> <*>,96
No node to choose.,97
"First trial failed, node has no type SSD, making second trial carrying this type",98
Fetched delegation token from namenode<*>,99
Token service set to namenode<*>:<*>,100
Token added successfully,101
trying to get DT with no secret manager running,102
Namesystem image is not loaded,103
Namesystem image is loaded,104
Number of INodes (<*>) exceeds iip length (<*>),105
Quota check <*> <*> skipQuotaCheck is <*>,106
Quota verification completed successfully,107
Updated INode count to <*>,108
Retrieved storage policy ID <*>,109
Number of INodes (<*>) does not exceed iip length (<*>),110
Shutdown completed for block pool data_pool_<*>,111
Removed block pool slices for data_pool_<*>,112
"Success: removeCachePool, poolName: data_pool_<*>, true",113
"Failure: removeCachePool, poolName: data_pool_<*>, false",114
"Exception in writeLock during removeCachePool, poolName: data_pool_<*>, false",115
Namenode startup check succeeded,116
Received datanode report from namenode<*>,117
Established connection with peer at <*>.<*>.<*>.<*>:<*>,118
Set <*> timeout to <*>ms,119
Sent <*> bytes to peer,120
Peer send operation succeeded,121
Peer send operation failed: Connection reset by peer,122
Cleaned up resources with logger,123
Removing unknown block <*>,124
File <*> is not under construction. Skipping add to low redundancy open files!,125
mkdirs: created directory <*>,126
Probing NN at service address: namenode<*>:<*>,127
Cannot fetch safemode state for namenode<*>:<*>,128
The target has been modified since snapshot <*><*>,129
Failed to compute snapshot diff on <*><*> due to IOException,130
Operation check succeeded for path <*>,131
Retrieved block locations for path <*> from namenode<*>,132
Sequential operation completed successfully,133
"DFSClient flush(): bytesCurBlock=<*>, lastFlushOffset=<*>, createNewBlock=true",134
Unable to persist blocks in hflush for <*>,135
Error while syncing,136
excess types chosen for block <*> among storages <*> is empty,137
Choose redundant EC replicas to delete from blk_<*> which is located in <*>,138
Found duplicated storage UUID: storage-<*> in <*>,139
Loading InMemoryAliasMapWriter for block pool id pool-<*>,140
"Failed to updateBlock (newblock=<*>, datanode=datanode<*>)",141
Lock <*> successfully,142
Endpoint shared memory manager initialized,143
Free slot allocated successfully in shared memory,144
Interrupted during wait interval,145
Fetched RBF metrics successfully,146
Number of stale nodes: <*>,147
Failed to get number of stale nodes,148
closeImpl invoked successfully,149
IOException occurred: Failed to close resource,150
Resource closed successfully,151
Fetched erasure coding codecs from namenode<*>,152
RPC proxy stopped successfully,153
Exception occurred while modifying cache pool,154
modifyCachePool of data_pool_<*> successful; set <*> to <*>,155
modifyCachePool of data_pool_<*> successful; set default replication to <*>,156
modifyCachePool of data_pool_<*> successful; no changes.,157
Deactivation request received for <*> volume: <*><*>,158
No directory is specified.,159
Cannot get children for <*>,160
Error encountered requiring NN shutdown. Shutting down immediately.,161
File copied successfully from <*> to <*> using nativeCopyFileUnbuffered,162
Evicted expired entries from cache,163
Cleared cache successfully,164
InterruptedException occurred during cache operation,165
"logAuditEvent(false, setAcl, <*>)",166
"logAuditEvent(true, setAcl, <*>, null, FileStatus{path=<*>, isDirectory=true, length=<*>, modificationTime=<*>, owner=hadoop_user, group=hadoop_group, permission=rwxr-xr-x})",167
Initializing replication queues,168
Processing mis-replicated blocks,169
Replication queues initialized successfully,170
NFS READDIR fileHandle: <*> cookie: <*> count: <*> client: <*>.<*>.<*>.<*>,171
Retry cache on namenode is <*>,172
Retry cache will use <*>.<*> of total heap and retry cache entry expiry time is <*> millis,173
JournalNodeRpcServer initialized successfully,174
Received journal request for block <*> at offset <*>,175
Successfully wrote journal entry for block <*>,176
JournalNodeRpcServer completed request successfully,177
Purging logs older than <*>,178
Marking stale logs for transaction ID <*>,179
Replaced URI prefix with webhdfs:<*><*>:<*>,180
Initialized WebHdfsHandler for webhdfs:<*><*>:<*>,181
Channel read operation completed successfully,182
"Invalid number of arguments provided. Expected <*>, got <*>.",183
File system is not an instance of DistributedFileSystem.,184
Successfully initialized FileSystem for URI: hdfs:<*>:<*>,185
IOException occurred while processing file: <*>,186
Stack trace: java.io.IOException: File not found,187
File processing completed successfully.,188
"Re-scanned block block_<*>, result is SUCCESS",189
Caught InterruptedException while scheduling replication work for mis-replicated blocks,190
Removing zone zone_<*> from re-encryption.,191
The quota system is disabled in Router.,192
Permission denied: hadoop_user is not allowed to change quota of <*>,193
Quota set successfully for <*>,194
Invocation to <*> for <*> timed out,195
Cannot execute getFileInfo in namenode<*>: Connection timed out,196
"Exception from remote name node namenode<*>, try next.",197
Uncaching of <*><*> completed. usedBytes = <*>,198
Deferred uncaching of <*><*> completed. usedBytes = <*>,199
Fetched default URI: hdfs:<*><*>:<*>,200
Retrieved configuration for path <*>,201
Append chunk set to <*>,202
Checksum buffer size reset to <*> bytes,203
Packet chunk size computed as <*> bytes,204
Triggered block report for DataNode,205
Analyzed storage directory <*>,206
Refreshed storage metadata for pool-<*>,207
Journal created,208
Successfully fetched next subdirectory <*>,209
NFS READLINK fileHandle: <*> client: hadoop_user,210
Can't get path for fileId: <*>,211
"Not a symlink, fileId: <*>",212
"Symlink target should not be null, fileId: <*>",213
Link size: <*> is larger than max transfer size: <*>,214
getBlockLocalPathInfo successful block=<*> blockfile=<*> metafile=<*>,215
getBlockLocalPathInfo for block=<*> returning null,216
Erasure coding policy disabled successfully,217
Journal created successfully at <*>,218
Edit log manifest fetched successfully,219
Manifest converted to builder format,220
Builder initialized with manifest,221
Bound HTTP address retrieved: https:<*>:<*>,222
Port number retrieved: <*>,223
HTTP port set to <*>,224
HTTP server URI set to https:<*>:<*>,225
URL set from https:<*>:<*>,226
Lifeline sent successfully to namenode<*>,227
Access to BPServiceActor$LifelineSender granted,228
NFS READ fileHandle:<*> offset:<*> count:<*> client:<*>.<*>.<*>.<*>,229
Exception when adding <*> to the file system,230
Checking NameNode startup status,231
Superuser privileges verified successfully,232
Layout version verified successfully,233
Backup node registered successfully,234
Initialized PmemVolumeManager for persistent memory volume,235
No entries remaining in the pending list.,236
Cleared trash for pool data_pool_<*>,237
Fetched namenode service ID: namenode<*>,238
Initialized configuration with generic keys,239
Unset HA special independent keys for namenode<*>,240
Inconsistent number of corrupt replicas for block_<*> blockMap has <*> but corrupt replicas map has <*>,241
Failed to get snapshottable directories. Ignore and continue.,242
"*BLOCK* NameNode.blockReport: from datanode<*>, reports.length=<*>",243
Successfully renamed reserved paths during upgrade,244
Retrieved layout version <*>,245
Fetched INode for path <*>,246
Loaded children for INode <*>,247
Other JournalNode addresses not available. Journal Syncing cannot be done,248
Could not add proxy for Journal at address <*>.<*>.<*>.<*>,249
Cannot sync as there is no other JN available for sync.,250
DatanodeAdminMonitorV<*> is running.,251
"Namesystem is not running, skipping decommissioning<*> checks.",252
DatanodeAdminMonitor caught exception when processing node.,253
Checked <*> blocks this tick. <*> nodes are now in maintenance or transitioning state. <*> nodes pending. <*> nodes waiting to be cancelled.,254
Repetitive policies in EC policy configuration file: RS-<*>-<*>-<*>k,255
IOException occurred while calling getWriter in <*>,256
under <*> block <*><*>: <*>,257
over replicated block <*><*>: OVER_REPLICATED,258
invalid block <*><*>: INVALID,259
postpone block <*><*>: POSTPONE,260
Interrupted while processing replication queues.,261
Successfully purged logs older than <*> days,262
Created Paxos directory at <*>,263
Purged <*> matching log files from <*>,264
"Failed to re-encrypt one batch of <*> edeks, start:<*>",265
Audit Event: setReplication,266
Successfully set owner for path <*> to hadoop_user,267
Failed to replace datanode. Continue with the remaining datanodes since BEST_EFFORT_KEY is set to true.,268
Access denied to path <*> <*> Audit: setPermission successful for src <*> with permissions READ|WRITE <*> Audit: setPermission failed due to AccessControlException for src <*>,269
"logAuditEvent(false, getAclStatus, <*>)",270
"logAuditEvent(true, getAclStatus, <*>)",271
Removed ACL entries for path <*>,272
Cannot access storage directory <*>,273
<*> does not exist. Creating ...,274
<*> is not a directory,275
Unable to acquire file lock on path <*>,276
Upgrade is not supported from this older version <*> of storage to the current version. Please upgrade to <*>.<*> or a later version and then upgrade to current version. Old layout version is <*> and latest layout version this software version can upgrade from is <*>.,277
Fetched storage policies from namenode<*>,278
Cannot request to satisfy storage policy when storage policy satisfier feature has been disabled by admin. Seek for an admin help to enable it or use Mover tool.,279
Verified outstanding path quota limit successfully.,280
Verifying superuser privileges,281
Waiting for RetryCache completion,282
Cache entry found and marked as successful,283
Checkpoint completed successfully,284
RetryCache state updated,285
Saved MD<*> d<*>d<*>cd<*>f<*>b<*>e<*>ecf<*>e to <*><*>sum.txt,286
Starting journal mapping process,287
Retrieved manager instance successfully,288
Recovering unfinalized segments from <*>,289
Successfully recovered <*> unfinalized segments,290
MembershipStoreImpl cache loaded,291
CachedRecordStore cache loaded,292
MembershipNamenodeResolver cache loaded,293
MountTableResolver cache loaded,294
"Log Audit Event: <*> enableErasureCodingPolicy, RS-<*>-<*>-<*>k",295
Setting erasure coding policy,296
Logging RPC IDs,297
logAuditEvent success,298
Number of suppressed write-lock reports: <*>\nLongest write-lock held at <*>-<*>-<*>T<*>:<*>:<*> for <*>ms via <*>\nTotal suppressed write-lock held time: <*>ms,299
Namespace quota set,300
Diskspace quota set,301
logSync(tx) synctxid=<*> lastJournalledTxId=<*> mytxid=<*>,302
Number of transactions: <*> Total time for transactions(ms): <*> Number of transactions batched in Syncs: <*> Number of syncs: <*> SyncTimes(ms): <*>,303
Checked if path <*> is in snapshot,304
Path <*> is in snapshot,305
Applied umask <*> to directory <*>,306
Created directory <*> with permissions <*>,307
Replication factor unchanged. No action required.,308
Replication factor updated from <*> to <*>.,309
Reconstruction queue updated for block <*>.,310
Processing extra redundancy for block <*> with new replication factor <*>.,311
No extra redundancy processing required for block <*>.,312
"read(arr.length=<*>, off=<*>, len=<*>, filename=<*><*>.txt, block=block_<*>, canSkipChecksum=true): starting",313
"read(arr.length=<*>, off=<*>, len=<*>, filename=<*><*>.txt, block=block_<*>, canSkipChecksum=true): returning <*>",314
Cached dfsUsed found for <*>,315
"elapsed time:<*> is greater than threshold:<*>, mtime:<*> in file:<*><*>.txt, will proceed with Du for space computation calculation",316
"mtime not found in file:<*><*>.txt, will proceed with Du for space computation calculation",317
"cachedDfsUsed not found in file:<*><*>.txt, will proceed with Du for space computation calculation",318
Fetched configuration value for key hdfs.namenode.rpc-address,319
Resolved namenode address to namenode<*>:<*>,320
Retrieved namenode IDs: <*>,321
No valid namenode IDs found in configuration,322
Configuration name is present,323
Target is not null,324
Whitespace trimmed from target,325
URI created,326
Port is -<*>,327
"Host is not null, port is valid, scheme is present, and path is null",328
Socket address created for host,329
Address creation completed,330
Stopping RPC proxy for namenode<*>,331
Preallocated <*> bytes at the end of the edit log (offset <*>),332
Fsck: deleted corrupt file <*>,333
Fsck: error deleting corrupted file <*>,334
Successfully cleaned up resources using IOUtils.cleanupWithLogger,335
Added new encryption keys to BlockTokenSecretManager,336
Fetched namespaces successfully,337
Cannot fetch number of expired registrations from the store: Failed to connect to namenode,338
Connecting to datanode datanode<*>:<*>,339
Send buf size <*>,340
Replaced expired token: ABC<*>XYZ,341
Refreshed host properties for CombinedHostFileManager,342
Retrieved configuration value for key <*> with default value <*>,343
requestShortCircuitFdsForRead failed,344
Stopping service namenode<*>,345
Joining threads for service namenode<*>,346
Service namenode<*> stopped successfully,347
Exception while selecting input streams,348
StoragePolicySatisfier stopGracefully executed successfully,349
Checking namenode startup status,350
Operation check completed,351
Cache entry found and successful,352
RetryCache wait for completion initiated,353
Setting extended attribute for path <*>,354
RetryCache state updated successfully,355
Fetched file status for path <*>,356
Path <*> is not a directory,357
Listing status for path <*>,358
Successfully listed <*> files in <*>,359
Returning empty list for non-directory path <*>,360
File not found: <*>,361
IOException while listing status for path <*>,362
Disk Balancer - Internal Error.,363
RPC IDs logged for operation ModifyCacheDirectiveInfoOp,364
Edit logged for directive <*> with access READ|WRITE,365
Unregistered shared memory segment,366
Synchronized shared memory state,367
Preconditions check passed,368
Invalidated slot <*>,369
Freed slot <*>,370
Exited unregisterShm operation,371
"SSL config sslProp is missing. If dfs.server.https.keystore.resource is specified, make sure it is a relative path",372
logRpcIds called,373
logEdit called,374
"Validating input parameters: offset=<*>, length=<*>",375
Acquired read lock for path <*>,376
Resolved path <*> to inode ID <*>,377
Checking permissions for user hadoop_user,378
Permission check passed for user hadoop_user with access READ,379
Creating located blocks for path <*>,380
Successfully created GetBlockLocationsResult with <*> blocks,381
Released read lock for path <*>,382
Snapshot detected for path <*>,383
Calculating minimum block size for snapshot,384
Permission check skipped as permission is disabled,385
Successfully read file <*>,386
Parsed host entry for namenode<*>,387
Successfully created journal with ID journal_<*> for name service ns_<*>,388
Finalized journal journal_<*> successfully,389
BPOfferService interrupted while waiting for block report,390
Entering run method,391
Mover took <*> milliseconds,392
"Received versionRequest response: NamespaceInfo{clusterID=cluster-<*>, blockPoolID=pool-<*>}",393
Problem connecting to server: namenode<*>:<*>,394
Fetched RPC addresses for nameservice <*>,395
Created non-HA proxy for namenode at <*>,396
Retrieved current user <*>,397
Calculated network distance between datanode<*> and namenode<*> as <*> hops,398
Created new block reader for block ID <*> on datanode<*>,399
Retrieved peer cache for datanode<*>,400
Successfully completed block read operation,401
Fetched suffix IDs for keys: <*>,402
Valid suffix IDs found: <*>,403
No valid suffix IDs found for keys: <*>,404
"Audit event: create, <*>, SUCCESS",405
"Audit event: create, <*>, Access denied",406
Skipped <*> bytes in <*>,407
skip discarded <*> bytes from dataBuf and advanced dataPos by <*>,408
LeaseManager is interrupted,409
Unexpected throwable:,410
Could not sync enough journals to persistent storage due to No journals available to flush. Unsynced transactions: <*>,411
lease has expired hard limit,412
Payload retrieved successfully,413
RetryCache operation completed,414
Cache directive added successfully,415
RetryCache state updated to COMPLETED,416
Updated pipeline for block <*> on datanode<*>,417
Using clusterid: cluster-<*>,418
"Clusterid mismatch - current clusterid: cluster-<*>, Ignoring given clusterid: cluster-<*>",419
Audit event for listStatus operation <*> on <*>,420
Added internal servlet for path <*><*><*>,421
Successfully checked operation,422
Retrieved namespaces from ActiveNamenodeResolver,423
Concurrent invocation completed successfully,424
Processed all values in ret,425
Proxying operation:,426
Creating compression for FS image,427
Saving namespace context,428
Saving image to target directory <*>,429
Purging old legacy OIV images,430
Acquired read lock for rolling upgrade process,431
Retrieved rolling upgrade info from namenode<*>,432
"Rollback images not created, proceeding to set rollback images",433
Released read lock,434
Created RollingUpgradeInfo.Bean for tracking,435
Encountered exception setting Rollback Image,436
Fetched configuration values for trimmed string collection,437
Converted string collection to URIs successfully,438
SetAclOp instance created successfully,439
ACL edit logged successfully for path <*> with permissions READ|WRITE,440
Block deletion time is set to <*>-<*>-<*>T<*>:<*>:<*>Z,441
The block deletion will start around <*>-<*>-<*>T<*>:<*>:<*>Z,442
Fetched parent path from <*>,443
Periodic heartbeat sent to namenode<*>,444
Quota update completed for <*>,445
State store <*> <*> successfully,446
Router safemode status checked,447
Router heartbeat sent to namenode<*>,448
Cannot heartbeat for router: unknown router id,449
Cannot heartbeat router: State Store unavailable,450
"Cannot heartbeat router, IOException:",451
Router heartbeat for router,452
checkOperation succeeded,453
readLock acquired,454
getStoragePolicies retrieved,455
readUnlock performed,456
Operation completed. Audit event logged successfully,457
Audit event failed due to AccessControlException,458
Exception while adding a block,459
NotReplicatedYetException sleeping src retries left <*>,460
Caught exception,461
Successfully registered MBean for metrics under namenode,462
"Failed to close provider., java.io.IOException: Disk full",463
IOException exception cannot be retried,464
<*> does not allow retrying a failed subcluster,465
Cannot invoke readBlock for <*>: Connection refused,466
<*> allows retrying failed subclusters in <*>,467
Cannot invoke readBlock for <*> in <*>: Connection refused,468
Operation check succeeded on rpcServer,469
Concurrent invocation succeeded on rpcClient,470
Fetched namespaces from ActiveNamenodeResolver,471
Updating State Store cache,472
Logged info for <*> of <*> blocks reported.,473
Content summary computed for path <*>,474
Erasure coding policy name retrieved: RS-<*>-<*>-<*>k,475
Unable to rename checkpoint in directory <*><*>,476
"timed poll(): poll() returned null, sleeping for <*> ms",477
timed poll(): timed out,478
"timed poll(): poll() returned null, sleeping for <*>ms",479
The scanning start dir<*> dir <*> does not have children.,480
Starting upgrade of edits directory,481
Failed to move aside pre-upgrade storage in image directory,482
Block files moved to rbw directory,483
RBW replica created,484
Checksum loaded and data length set,485
Tailing edits starting from txn ID <*> via RPC mechanism,486
"Encountered exception while tailing edits >= <*> via RPC; falling back to streaming., java.io.IOException: Connection refused",487
ProviderBlockIteratorImpl initialized successfully,488
ProviderBlockIteratorImpl load succeeded,489
DataNode instantiated successfully,490
Starting DataNode daemon on port <*>,491
DataNode daemon started successfully,492
"Failed to instantiate DataNode, dn is null",493
Error retrieving hostname,494
unknown POST <*><*><*>,495
Cannot send OOB response SUCCESS. Responder not running.,496
Sending an out of band ack of type SUCCESS,497
Preconditions.checkNotNull succeeded,498
FsDatasetSpi.updateReplicaUnderRecovery succeeded,499
Block generation stamp set to <*>,500
Block <*> set to <*>,501
Namenode notified of received block,502
Loading <*> inodes.,503
Sorting inodes,504
Finished sorting inodes,505
Concurrent execution enabled for source <*>,506
Invoked <*> RPC call to datanode<*>,507
Sequential execution enabled for source <*>,508
Temporary redirect with URI https:<*>:<*><*>,509
Returning JSON response with location https:<*>:<*><*>,510
Temporary redirect with URI https:<*>:<*><*> for file checksum,511
Returning JSON response with location https:<*>:<*><*> for file checksum,512
Delegation token retrieved for user hadoop_user,513
Block locations retrieved for path <*>,514
"Skipped checking all volumes, time since last check <*> is less than the minimum gap between checks (<*> ms)",515
checkAllVolumesAsync - no volumes can be referenced,516
Scheduled health check for volume <*><*>,517
checkAllVolumes timed out after <*> ms maxAllowedTimeForCheckMs,518
Preconditions check passed for transaction ID <*>,519
Fetched storage file <*><*>,520
Successfully wrote <*> bytes to <*><*>,521
Failed to mkdirs <*>,522
